tweet,label_1,label_2,final_label
techrax youtube channels owner taras maksimuk purposely crashed a car with an iphone pro taped to a seat to test the phones crash detection feature after crashing the remotecontrolled car into a pile of old vehicles he said i can confirm the crash detection works,POSITIVE,POSITIVE,POSITIVE
howto turn off the notification sound when charging for airpodspro,NEUTRAL,NEUTRAL,NEUTRAL
fnb connect deals iphone iphone pro and iphone pro max fnb iphone iphonepro iphonepromax preorder contract apple mobile fnbconnect ios tech technews technology southafrica durban capetown johannesburg,NEUTRAL,NEUTRAL,NEUTRAL
its friday and apple watch ultra and airpods delivery day applewatchultra airpodspro,NEUTRAL,NEUTRAL,NEUTRAL
a feature or another brick in the walled garden ios iphone,NEUTRAL,NEUTRAL,NEUTRAL
apple watch for just rs get the worlds most stylish watch on your wrists now,NEUTRAL,NEUTRAL,NEUTRAL
iphone series price list gb pro gb black purple pro max gb gold,NEUTRAL,NEUTRAL,NEUTRAL
after first days of pro max usage im noticing less battery backup than my pro max iphone apple ios iphonepromax,NEUTRAL,NEUTRAL,NEUTRAL
new phone new me they say the incredible iphone is available for purchase buy it here,NEUTRAL,POSITIVE,POSITIVE
hot deal iphone for k promo promo,NEUTRAL,NEUTRAL,NEUTRAL
applewatchultra delivers tomorrow looking forward to it,POSITIVE,POSITIVE,POSITIVE
this on the airpodspro with the recent update of personalized spatial audio it sounds lit,NEUTRAL,NEUTRAL,NEUTRAL
iphone pro provides up to faster g speeds,NEUTRAL,POSITIVE,POSITIVE
let the fun begin applewatchultra,POSITIVE,POSITIVE,POSITIVE
preordered the iphone pro space black as my treat iphonepro appleevent,POSITIVE,POSITIVE,POSITIVE
latest single islima out,NEUTRAL,NEUTRAL,NEUTRAL
sister just ordered iphone for me,NEUTRAL,NEUTRAL,NEUTRAL
prod by wallpapers apple iphone ios iphone iphonepro iphonepromax iphoneplus wallpapers neumorphism logo lockscreen homescreen,NEUTRAL,NEUTRAL,NEUTRAL
the owner of youtube channel techrax simulated a realcar crash to confirm whether this feature actually works or not iphone,NEUTRAL,NEUTRAL,NEUTRAL
been a busy few days for me and new apple gadgets now time to go and enjoy them appleevent applewatchultra iphonepro,POSITIVE,POSITIVE,POSITIVE
now leaking iphone plus demoloop before launch day,NEUTRAL,NEUTRAL,NEUTRAL
lackrule blue silicone back cover compatible for iphone order on whatsapp,NEUTRAL,NEUTRAL,NEUTRAL
wallpapers homescreen iphonepromax iphonepro iphoneplus iphone iphonepromax iphonepro iphone iphone,NEUTRAL,NEUTRAL,NEUTRAL
happy applewatchultra day let the adventure begin,POSITIVE,NEUTRAL,POSITIVE
iphone pro camera issues being widely reported using tik tok or snapchat should be an easy fix someone called this iphoneharlemshakegate iphone iphonepro iphonepromax defective harlemshake apple mac applerepair righttorepair tecktok techtoker sysadmin,NEUTRAL,NEUTRAL,NEUTRAL
should i uber home on my lunch hour tomorrow to pickup my applewatchultra and airpodspro,NEUTRAL,NEUTRAL,NEUTRAL
dynamicisland notchwallpapers for iphonepromax add to it these are ones i made from android wallpapers,NEUTRAL,NEUTRAL,NEUTRAL
iphonepromax gb esim prix f,NEUTRAL,NEUTRAL,NEUTRAL
match matchy with lisa iphonepro rimowaphonecase bornpink shutdown blackpink,NEUTRAL,NEUTRAL,NEUTRAL
its amazing how every few years apple decides to killhurt a certain industrys highend incumbents and does so pretty well phones wearable audio intel daily watches etc now the applewatchultra is out to hurt garmin casio and other extremeadventure wrist computers,POSITIVE,POSITIVE,POSITIVE
dont buy iphone propro max before watching this video iphone pr,NEUTRAL,NEGATIVE,NEGATIVE
why does my iphone pro max only show mp in info instead of iphonepro iphonepromax,NEUTRAL,NEUTRAL,NEUTRAL
apple iphone amp plus first look,NEUTRAL,NEUTRAL,NEUTRAL
why do yaw keep repackaging this old technology where is the new technology apple iphone verizon attg,NEGATIVE,NEUTRAL,NEGATIVE
picked up iphone pro max and apple watch while i was out today appleevent applewatch iphonepromax,POSITIVE,POSITIVE,POSITIVE
first actionmode video taken on a walk today the little jump really shows the stabilization iphonepromax,NEUTRAL,NEUTRAL,NEUTRAL
atomichabitsbooktwitter order,NEUTRAL,NEUTRAL,NEUTRAL
i need this iphonepromax,NEUTRAL,NEUTRAL,NEUTRAL
i dont know why people spend months of there salary in depreciating assets ewwww iphone vs bitcoin,NEGATIVE,NEGATIVE,NEGATIVE
iphone pro max deep purple hands oniphone pro max unboxing,NEUTRAL,NEUTRAL,NEUTRAL
iphonepromax night videography test,NEUTRAL,NEUTRAL,NEUTRAL
i am very happy to be participating in this project appleevent iphone,POSITIVE,POSITIVE,POSITIVE
srsworks new arrivalsback to black spigen for iphone is now here,NEUTRAL,NEUTRAL,NEUTRAL
we might see ios released as soon as next week apple bugs iphonepromax iphonepro,NEUTRAL,NEUTRAL,NEUTRAL
if we look at the exterior design the iphone and series arent that different apple iphone iphonerepairability iphoneseries iphoneteardown righttorepair,NEUTRAL,NEUTRAL,NEUTRAL
did you know ios now contains a builtin photo dededuplicator tap on photosgtalbumsgtduplicates and it can intelligent merge them by resolution and quality it will keep the highest quality image no need for a separate app photography apple iphone iphone,POSITIVE,POSITIVE,POSITIVE
youre being worked on by genius level marketing,NEUTRAL,NEUTRAL,NEUTRAL
first result of chief slector ki cheap selection pakvseng asiacup iphonepro pakistanzindabad pakistan teampakistan,NEUTRAL,NEUTRAL,NEUTRAL
blankets on couch ideas tassels woven throw blanket for bed couch decorased offer up to off,NEUTRAL,NEUTRAL,NEUTRAL
iphonedealonamazon iphone iphone apple appleevent pinkvenomchallenge yearswithdna apple iphone gb b,POSITIVE,POSITIVE,POSITIVE
how to hide unhide apps on iphone iphone pro,NEUTRAL,NEUTRAL,NEUTRAL
ultfone announces new release of its iphone compatible toolkit,NEUTRAL,NEUTRAL,NEUTRAL
check out,NEUTRAL,NEUTRAL,NEUTRAL
follow for more lacasadeldragon tomchase twitchstopgambling queensfuneral jcole pregnant pregnant iphone,NEUTRAL,NEUTRAL,NEUTRAL
thank you applewatchse,POSITIVE,POSITIVE,POSITIVE
iphone it has qualcomm modem that talks to satellites,NEUTRAL,NEUTRAL,NEUTRAL
iphonepro iphone iphonexaisg apple iphone pro max leather case with magsafe forest green http,NEUTRAL,NEUTRAL,NEUTRAL
iphonepromax ka phone,NEUTRAL,NEUTRAL,NEUTRAL
the camera on iphonepromax is,NEUTRAL,NEUTRAL,NEUTRAL
iphone voice,NEUTRAL,NEUTRAL,NEUTRAL
check out my item listing on opensea avax cryptos iphonepro switzerland bsayachtclub nfts apefollowape nftsc,NEUTRAL,NEUTRAL,NEUTRAL
got the iphone,NEUTRAL,NEUTRAL,NEUTRAL
i closed all three of my activity rings every day during the week of september with my applewatch,NEUTRAL,NEUTRAL,NEUTRAL
coming soon the iphoneseries the iphone iphoneplus iphonepro amp iphonepromax test results are coming soon what are your predictions if you missed it earlier we have an instagram exclusive apple iphone pro max giveaway,NEUTRAL,NEUTRAL,NEUTRAL
would you rather take the phone or the parcel of land iphone realestate sale investment properties landforsale theadonaipeople golfcityestate investing lookingforland adonailands landssupermarket motown jamzalbum,NEUTRAL,NEUTRAL,NEUTRAL
when your husband spills a margarita on your new iphonepro you know him right not even t hours old,NEUTRAL,NEUTRAL,NEUTRAL
brand new sealed iphone pro max dual sim gb gh gb gh available now iphonepro iphone iphone jamzalbum kofi jamar queensfuneral kotoko jackline mensah shoes mondaymotivation udinese gmb peter vernamineralwater kounde,NEUTRAL,NEUTRAL,NEUTRAL
overall which one would you pick iphonepromax iphonepro,NEUTRAL,NEUTRAL,NEUTRAL
apple watch unable to auto unlock mac after watchos update here is the fix,NEUTRAL,NEUTRAL,NEUTRAL
iphone has not been upgraded much compared to last year the market performance is far less than that of the iphone pro and pro max according to times finance foxconnzhengzhou has dismantled or will dismantle at least workshops for the iphone production linekrkr,NEGATIVE,NEGATIVE,NEGATIVE
for anyone with an iphone promax is your camera rattling iphonepromax iphonepro iphone apple iphone iphoneseries,NEUTRAL,NEUTRAL,NEUTRAL
yes yes iphonepromax,POSITIVE,POSITIVE,POSITIVE
lovehandle phone grip for most smartphones and mini tablets,NEUTRAL,NEUTRAL,NEUTRAL
a rumor claims that k video longer battery life and more could be coming in iphone iphone appleiphone apple,NEUTRAL,NEUTRAL,NEUTRAL
shot on iphone pro max,NEUTRAL,NEUTRAL,NEUTRAL
box of the new gold iphonepromax in front of the cathedral of santa maria del fiore at piazza del duomo in florence tuscany italy youtube,NEUTRAL,NEUTRAL,NEUTRAL
apple watch ultra is here but will this rugged beast replace my entire traditional watch collection its apple watch ul,NEUTRAL,POSITIVE,POSITIVE
hello to you too iphonepro,POSITIVE,POSITIVE,POSITIVE
iphonepromax mp,NEUTRAL,NEUTRAL,NEUTRAL
this is how i see the new iphone appleevent,NEUTRAL,NEUTRAL,NEUTRAL
so got this video suggestion for iphone review i mean this is the closest i will come to experience this phone and t,NEUTRAL,NEUTRAL,NEUTRAL
the dynamic island is so well implemented on the iphonepro appleevent iphone,POSITIVE,POSITIVE,POSITIVE
iphonepro and iphonepro the camera differences are yuge apple iphone,NEUTRAL,NEUTRAL,NEUTRAL
heres how many working days youll need to be able to afford the iphone pro based on salary v smar,NEUTRAL,NEUTRAL,NEUTRAL
these watches are so big you could see them from space the apple watch is enormous at mm from edge to edge to edge,NEUTRAL,NEGATIVE,NEUTRAL
this is me hallucinating about having iphone,NEUTRAL,NEUTRAL,NEUTRAL
iphone pro pricing in india iphonepro iphone,NEUTRAL,NEUTRAL,NEUTRAL
iphone is already facing hardware issues iphone iphonepro iphonepromax iphonemax apple,NEUTRAL,NEUTRAL,NEUTRAL
iphone pro and pro max gb available in sliver and deep purple call iphonepromax platinumgadgets,NEUTRAL,NEUTRAL,NEUTRAL
apples crash detection emergency features on your new iphone apple watch and ultra devices can save your life explaining how they work and why theyre important click below for a minute description,POSITIVE,POSITIVE,POSITIVE
who has got new iphone on my tl check,NEUTRAL,NEUTRAL,NEUTRAL
new iphone pro max now available dm asap big deals iphonepro iphonepromax iphone applepromax,NEUTRAL,NEUTRAL,NEUTRAL
samsung has face id,NEUTRAL,NEUTRAL,NEUTRAL
gotta post it here since instagram stonewalled me from posting it apple onto us guys dont let them take it down deeppurple apple iphonepro,NEUTRAL,NEUTRAL,NEUTRAL
the new apple watch ultra is the most innovative watch yet its design and features are truly amazing,POSITIVE,POSITIVE,POSITIVE
whats with the black line down the screen does applewatch have a screen that refreshes left to right,NEUTRAL,NEUTRAL,NEUTRAL
you can get a iphone anywherebut there is only one of youill take you sweetsxo,NEUTRAL,NEUTRAL,NEUTRAL
i could change by brakes times for the price of an iphone unless the iphone can give bjs now ill pass,NEGATIVE,NEGATIVE,NEGATIVE
airpodspro blew me away god damn,POSITIVE,POSITIVE,POSITIVE
thanks due to high demand i lost interest buying your new flagship iphonepromax,NEGATIVE,NEGATIVE,NEGATIVE
apple watch ultra a chonky boy apple applewatch applewatchultra elmhurst,NEUTRAL,NEUTRAL,NEUTRAL
airpods pro apple airpodspro,NEUTRAL,NEUTRAL,NEUTRAL
now here comes an iphone with a transparent back panel iphone,NEUTRAL,NEUTRAL,NEUTRAL
we too wan buy iphone nau,NEUTRAL,NEUTRAL,NEUTRAL
moving on to the applewatchseries review writes that the new features on the series arent flashy but they could save your life,POSITIVE,POSITIVE,POSITIVE
iphone pro and prommax iphoneonflipkart iphonepro rushhourftjhope,NEUTRAL,NEUTRAL,NEUTRAL
lackrule black silicone back cover compatible for iphone order on whatsapp,NEUTRAL,NEUTRAL,NEUTRAL
armour fully upgraded part iphonepro deeppurple amazingthing,NEUTRAL,NEUTRAL,NEUTRAL
i see that folks in apc and pdp have mischievously twisted interview on cnn to mislead northern voters i watched that interview and attended herewith are my candid thoughts obidatti obidientmovement emilokan ebonyi iphonepro lgbt takebacknaija,NEUTRAL,NEUTRAL,NEUTRAL
one call fixes all cracked screen battery change speaker change we do everything contact now visit our website,NEUTRAL,NEUTRAL,NEUTRAL
instant heartattack iphonepromax iphoneplus iphoneseries,NEUTRAL,NEUTRAL,NEUTRAL
handson iphone pro apple iphonepro,NEUTRAL,NEUTRAL,NEUTRAL
when you ask artificialintelligence to design the apple car this is the result iphone technologynews,NEUTRAL,NEUTRAL,NEUTRAL
where can i find instructions on how to obtain a return kit for my old phone under the appleupgradeprogram i wouldve thought i should receive an email with instructions when i picked up my new iphone but i didnt,NEUTRAL,NEUTRAL,NEUTRAL
the new apple watch ultra alpine loop dont like it ended up using my sports loop which works quite well with it appleultrawatch applewatchultra apple,POSITIVE,NEGATIVE,NEUTRAL
fuck you for breaking my music,NEGATIVE,NEGATIVE,NEGATIVE
after iphone apple all set to unveil iphone ultra with these new features iphone iphone,NEUTRAL,NEUTRAL,NEUTRAL
its timeapplewatchultra apple applewatch scubadiving,NEUTRAL,NEUTRAL,NEUTRAL
yo when is the iphonepro real review coming out i dont get new phones without your review first thats why ive been holding off on purchasing it i got the iphone pro,NEUTRAL,NEUTRAL,NEUTRAL
anybody with get a shipping notification for your iphonepromax,NEUTRAL,NEUTRAL,NEUTRAL
iphonepromax first impressions dynamic and different write amp,NEUTRAL,NEUTRAL,NEUTRAL
things ios allows you to do that you previously couldnt,NEUTRAL,NEUTRAL,NEUTRAL
lightstick ribbonpita lightstick kpop a thread v x vogue korea iphonepro iphone jungkook txtinjakarta sevent,NEUTRAL,NEUTRAL,NEUTRAL
here is a full megapixel picture taken from my iphone pro max apple iphone iphone iphonepro iphonepromax shotoniphone iphonephotography,NEUTRAL,NEUTRAL,NEUTRAL
samsung aod vs iphone which is better aod samsung iphone,NEUTRAL,NEUTRAL,NEUTRAL
so you cant even preorder the iphone over the phone with tmobile because of the widespread system issue tmobile iphonepromax apple,NEGATIVE,NEGATIVE,NEGATIVE
i did it iphonepromax,NEUTRAL,NEUTRAL,NEUTRAL
lets go hawks beat the niners gohawks seahawks seahawksnation seahawksunday applewatchseries iphonepro seattle washington,NEUTRAL,NEUTRAL,NEUTRAL
using the apple watch se made me realize you should consider it the default applewatch to buy and then look at the series not the other way around,NEUTRAL,NEUTRAL,NEUTRAL
apple watch ultra and airpods pro have arrived applewatchultra airpodspro,NEUTRAL,NEUTRAL,NEUTRAL
new sl thing on ios with showapp showlive icons palette_stock ioshomescreen iosicons shortcuts wallpaper me ios iphonepromax iphonepromax showlive swa,NEUTRAL,NEUTRAL,NEUTRAL
anyone know where i could get a cheap apple watch apple applewatch applewatchseries applewatchse,NEUTRAL,NEUTRAL,NEUTRAL
the baseband of iphone iphone plus also upgraded to snapdragon x g modem iphonepro iphone,NEUTRAL,NEUTRAL,NEUTRAL
two iphone iphone,NEUTRAL,NEUTRAL,NEUTRAL
exactly its not just lighting cables also the usbc cables from apple sucks i dont known if they do it on purpose applecableshitshow iphone,NEGATIVE,NEGATIVE,NEGATIVE
iphone pros usb lightning port may bottleneck proraw photo transfers iphonepro iphonepromax,NEUTRAL,NEUTRAL,NEUTRAL
after years finally iphonepro apple iphone,NEUTRAL,NEUTRAL,NEUTRAL
think i am going to do it yall pro max me iphonepromax,NEUTRAL,NEUTRAL,NEUTRAL
brand new iphone gb k iphone pro gb m iphone promax gb m bod gadgets devices iphonepromax iphone iphonepro deboleedevices,NEUTRAL,NEUTRAL,NEUTRAL
pelican protector slim rugged iphone pro case with ft drop protection,NEUTRAL,NEUTRAL,NEUTRAL
inc may make one out of four iphones in india by analysts said as the tech giant moves some production away from china amid mounting geopolitical tensions and covid strict iphone iphoneproductionindia,NEUTRAL,NEUTRAL,NEUTRAL
iphone pro camera testing what apples new cameras can do by,NEUTRAL,NEUTRAL,NEUTRAL
programming the applewatchultras action button to startlap a stopwatch might actually replace a physical stopwatch for some athletes my previous apple watches could do a lot but they couldnt serve as a stopwatch runners need physical buttons for interval training,NEUTRAL,NEGATIVE,NEUTRAL
apple watch track sports supplements vitamins amp medications applewatch,NEUTRAL,NEUTRAL,NEUTRAL
im looking at buying my rd applewatch i have plenty of bands why do i need to buy yet another band to get a watch cant i just buy the watch face i cant buy a watch at the moment as the only one in stock comes with a band i already own,NEUTRAL,NEUTRAL,NEUTRAL
queensfuneral iphone case iphone iphoneseries,NEUTRAL,NEUTRAL,NEUTRAL
left iphone right z fold,NEUTRAL,NEUTRAL,NEUTRAL
if there is a dead pixel after some brutal usage it would become a dynamic peninsular iphoneseries iphone,NEGATIVE,POSITIVE,NEGATIVE
iphone pro max giveaway check out the link below,NEUTRAL,NEUTRAL,NEUTRAL
dont buy the new iphone s let me explain iphone esim noesims iphonepromax iphonepro,NEUTRAL,NEUTRAL,NEUTRAL
flipkartbigbilliondays sale apple iphone under rs with bank discounts and offers,NEUTRAL,NEUTRAL,NEUTRAL
again,NEUTRAL,NEUTRAL,NEUTRAL
new video time for new iphone users tips and tricks for iphone pro,NEUTRAL,NEUTRAL,NEUTRAL
the new airpods pro cost and will be available september heres a look at the new specs appleevent,NEUTRAL,NEUTRAL,NEUTRAL
applewatch trendingnow apple watch se nd generation gps mm midnight aluminium case with midnight sport band regular,NEUTRAL,NEUTRAL,NEUTRAL
iphone purple abis,NEUTRAL,NEUTRAL,NEUTRAL
iphonepromax gb istyle reseller listing dhs left in stock,NEUTRAL,NEUTRAL,NEUTRAL
transfer whatsapp from old iphone to new iphone with icloud iphone iphonepro iphonepro iphonemini ios ios,NEUTRAL,NEUTRAL,NEUTRAL
omg pls pick me iphone appleevent giveaway iphonepro,POSITIVE,POSITIVE,POSITIVE
capturing new york on the iphonepro staggering details with the new mp sensor shotoniphone streetsofnewyork newyork,NEUTRAL,NEUTRAL,NEUTRAL
iphonepro selfie cam,NEUTRAL,NEUTRAL,NEUTRAL
apple iphoneseries ship today tracking the lines at the th ave aapl cube amp some of these fans have lined up since la,NEUTRAL,NEUTRAL,NEUTRAL
iphone then you after,NEUTRAL,NEUTRAL,NEUTRAL
the airpodspro are supposed to work with magsafe the charger sticks but the light isnt coming on any ideas airpods,NEUTRAL,NEUTRAL,NEUTRAL
what are amp doing at their table texting each other,NEUTRAL,NEUTRAL,NEUTRAL
iphone pro max review week later video is out now,NEUTRAL,NEUTRAL,NEUTRAL
xiaomi president asks fans if they want iphonepros latest feature read more here,POSITIVE,POSITIVE,POSITIVE
iphone pro max deep blue is lit check specs here,NEUTRAL,NEUTRAL,NEUTRAL
so far week several hours on phone amp several hours xfinitystore to transfer,NEUTRAL,NEUTRAL,NEUTRAL
kitty in mp iphonepro,NEUTRAL,NEUTRAL,NEUTRAL
is dennis prager really just someones fat dad dennisprager prager iphonepro untuckedph tiktokdown,NEUTRAL,NEUTRAL,NEUTRAL
airpodspro havent even hit official stores yet and they can be picked up for a slight discount already deals apple,NEUTRAL,NEUTRAL,NEUTRAL
got to video tommy stewarts dyerwulf with my new iphone pro in k friday night at the check out the qualit,NEUTRAL,NEUTRAL,NEUTRAL
mje toh milne wala hai tumhe bhi milega iphone by only spinning a wheel contestalert amazonspinandwin,NEUTRAL,NEUTRAL,NEUTRAL
im loving my new applewatchultra but its very judgey guess id better do some more exercise then,POSITIVE,NEGATIVE,POSITIVE
restocked baggy jean and bomber jacket now available again available in all size send us a dm,NEUTRAL,NEUTRAL,NEUTRAL
iphone content for iphone lock screen,NEUTRAL,NEUTRAL,NEUTRAL
i bought iphone pro max yesterday and i have seen the battery drain is excessive i dont know what is doing fix this issue of battery drain appleevent apple iphone iphonepromax,NEUTRAL,NEGATIVE,NEGATIVE
is my tag,NEUTRAL,NEUTRAL,NEUTRAL
action mode makes sure you dont need a gimbal appleevent iphone iphonepro iphoneplus iphonepromax https,POSITIVE,POSITIVE,POSITIVE
iphone or me iphone whatisokx,NEUTRAL,NEUTRAL,NEUTRAL
apple axes physical sim card slots from the iphone,NEUTRAL,NEUTRAL,NEUTRAL
cat iphone pro mp proraw converted to mp jpeg with photoshop iphonepro cats catsontwitter catsoftwittter,NEUTRAL,NEUTRAL,NEUTRAL
anthony goonetilleke group president of technology and head of strategy at amdocs gives his reaction to apples decision to go esimonly with iphone models sold in us in this mobile news article,NEUTRAL,NEUTRAL,NEUTRAL
ios developer beta has been released the battery bar matches the percentage and the size of the indicator is slightly larger download,NEUTRAL,NEUTRAL,NEUTRAL
i think they dropped it from the ground,NEUTRAL,NEUTRAL,NEUTRAL
i have an iphone and was looking into getting an iphone i pulled up your comparison to a year old iphone have you guys had years off work its almost identical,NEUTRAL,NEUTRAL,NEUTRAL
dont know why my twitter feed is full of iphone ads universe is this a sign of persuasion iphonepro,NEUTRAL,NEUTRAL,NEUTRAL
apple watch ultra reviews are out and honestly it looks amazing shoutout to for going diving full commitment i do wish the watch was a bit more subtle but its cool overall applewatchultra,POSITIVE,POSITIVE,POSITIVE
vintage christmas pinup flip iwatch face by gkm on,NEUTRAL,NEUTRAL,NEUTRAL
avax cryptos iphonepro switzerland bsayachtclub nfts apefollowape nftschweiz bayc apecoin otherside ap,NEUTRAL,NEUTRAL,NEUTRAL
got some purple wallpapers for a purple iphone apple iphone iphone iphonepro iphonepromax ios ios https,NEUTRAL,NEUTRAL,NEUTRAL
iphone promax available for shipping worldwide for more information iphonepromax,NEUTRAL,NEUTRAL,NEUTRAL
also need to cop the iphone,NEUTRAL,NEUTRAL,NEUTRAL
give your new iphone the protection it deserves shop dropproof cases now,NEUTRAL,NEUTRAL,NEUTRAL
iphoneiphone,NEUTRAL,NEUTRAL,NEUTRAL
hello would you please tell me what is it in my mac and how is it possible please help me out and solve it apple appleevent mac,NEGATIVE,NEGATIVE,NEGATIVE
got a new phone todayiphonepro,NEUTRAL,NEUTRAL,NEUTRAL
_ softlens ulzzang look_ diameter banyak pilihan warnanya rate,NEUTRAL,NEUTRAL,NEUTRAL
would love to know your thoughts you happy with apples latest iphone base models,NEUTRAL,NEUTRAL,NEUTRAL
ear tips in new airpods pro incompatible with older model apple airpodspro devices activenoisecancellation apple eartips,NEUTRAL,NEUTRAL,NEUTRAL
gday can we have more than one tesla supercharger in the state of tasmania australia also how about a tesla applewatch app,NEUTRAL,NEUTRAL,NEUTRAL
that new foxcon smell iphonepro,NEUTRAL,NEUTRAL,NEUTRAL
im not an apple employee and i dont work for apple they never taught me this iphonepromax apple appleevent apple,NEUTRAL,NEUTRAL,NEUTRAL
blue appleevent reactions and hype thread,NEUTRAL,NEUTRAL,NEUTRAL
the new iphone is only,NEUTRAL,NEUTRAL,NEUTRAL
iphonepro is in the market chalo atleast iphone might have come in the affordable range stillnotbuying,NEUTRAL,NEUTRAL,NEUTRAL
iphone se rd gen airpods apple watch se apple iphone airpods applewatch,NEUTRAL,NEUTRAL,NEUTRAL
iphonepromax apple official silicone cases chalk pink storm blue midnight productred,NEUTRAL,NEUTRAL,NEUTRAL
having some fun applewatchultra,POSITIVE,POSITIVE,POSITIVE
high quality tpupc two in one case new model update for iphoneseries customizable pattern logo packaging contact me for a list of models and prices whatsapp phonecase iphone samsung iphone cellphonecase mobilephonecase factory wholesale,NEUTRAL,NEUTRAL,NEUTRAL
charging my iphone pro max for the first time iphonepromax,NEUTRAL,NEUTRAL,NEUTRAL
iphonepromax tb price in turkey usd which is in us and in eu turkey is the country you can get the most expensive iphone thnx to government for the tax regulations,NEUTRAL,NEUTRAL,NEUTRAL
some photos from the hampstead heath iphonepromax shotoniphone,NEUTRAL,NEUTRAL,NEUTRAL
deep purple iphone pro unboxing and first impresssions,NEUTRAL,NEUTRAL,NEUTRAL
did you know that your ipad or iphone has an aod always on display way even before than the iphone pros and android p,NEUTRAL,NEUTRAL,NEUTRAL
iphone this is large for my small dick,NEUTRAL,NEUTRAL,NEUTRAL
decided to buy the new iphone,NEUTRAL,NEUTRAL,NEUTRAL
whats happening with the gps system on iphone im having big issues with the gps on ios on iphonepromax,NEGATIVE,NEGATIVE,NEGATIVE
the iphonepro is so heavy,NEUTRAL,NEUTRAL,NEUTRAL
box of the new gold iphonepromax in front of the cathedral of santa maria del fiore at piazza del duomo in floren,NEUTRAL,NEUTRAL,NEUTRAL
say hello to iphone a tiny upgrade for a tiny iphone in todays video we unboxed and set up the iphone and g,NEUTRAL,NEUTRAL,NEUTRAL
recently a man from kochi travelled all the way to dubai to buy a brand new iphone pro smartphone iphonepro,NEUTRAL,NEUTRAL,NEUTRAL
redrew sherb iphonepro animalcrossingnewhorizons digitalart art,NEUTRAL,NEUTRAL,NEUTRAL
one mrf stock costs more than iphone why is it so highlypriced,NEUTRAL,NEUTRAL,NEUTRAL
apple watch ultra unboxing with asmr apple applewatch applewatchultr,NEUTRAL,NEUTRAL,NEUTRAL
its cheaper to take a picture of things instead of always buying just to able to say you have them ps my new iphonepromax finance,NEUTRAL,NEUTRAL,NEUTRAL
checking out the new iphone max pro finsup miamidolphins dolohinlogo miami dolfan,NEUTRAL,NEUTRAL,NEUTRAL
buy all things apple this autumn apple appleiphone iphone iphonepro applewatch applewatchseries appleair,NEUTRAL,NEUTRAL,NEUTRAL
