tweet,label_1,label_2,final_label
shot this with my iphone pro max out hiking on a trial it reminded me of the video game,POSITIVE,NEUTRAL,POSITIVE
todays inspo for iphonepromax designed for iphone pro max case glitter pearlylustre shell colorful shiny laser starry pattern soft slim rightangled protective phone cover for iphone promax,NEUTRAL,NEUTRAL,NEUTRAL
you get started beginners guide to the iphone pro how to use the iphone pro max tutorial,NEUTRAL,NEUTRAL,NEUTRAL
iphone pro is out tho,NEUTRAL,NEUTRAL,NEUTRAL
this is must if you are buying an iphone grab this one now for just rs iphone iphonedealonamazon iphonepro iphone iphonepro iphone amazongreatindianfestival amazonindia deals,NEUTRAL,NEUTRAL,NEUTRAL
i believe the term is baaaaaaaaaahhhhhhhh iphonepro,NEUTRAL,NEUTRAL,NEUTRAL
my iphone camera quality is complete so i think its time for an upgrade iphonepromax,POSITIVE,POSITIVE,POSITIVE
iphone pro camera apple plans fix for shaking,POSITIVE,POSITIVE,POSITIVE
iphone pro colors gold purple black via,NEUTRAL,NEUTRAL,NEUTRAL
something new applewatchultra apple,NEUTRAL,POSITIVE,POSITIVE
i did say i wont be on twitter until october i had to show this ive replaced the iphonepromax for the new iphonepromax and i got the airpodpro next im getting if it online at the end of october belt psvr cant wait for it later,NEUTRAL,NEUTRAL,NEUTRAL
just walked into a dark bathroom and saw this thought id test night mode on the iphonepro turns out the hype is real,NEUTRAL,NEUTRAL,NEUTRAL
waiting in line at am for the new apple iphone pro max and unboxing,NEUTRAL,NEUTRAL,NEUTRAL
well played,POSITIVE,POSITIVE,POSITIVE
the iphone pro max is currently the most expensive phone we have ever had its a class of its own buy now h,NEUTRAL,NEGATIVE,NEGATIVE
jio esim is compatible with iphone purchased from any country click,NEUTRAL,NEUTRAL,NEUTRAL
iphone pro now available in kenya axelrod_hub iphonepro visit our store at sonalux mall shop m,NEUTRAL,NEUTRAL,NEUTRAL
still debating if i should get the new iphone,NEUTRAL,NEUTRAL,NEUTRAL
canon pixma mg wireless allinone color inkjet printer with mobile and tablet printing blackredwhite iphone ip,NEUTRAL,NEUTRAL,NEUTRAL
is this drip or skip iphone cover apple cover iphone vote,NEUTRAL,NEUTRAL,NEUTRAL
finally applewatchultra vs applewatchseries i cant feel any weight difference on the wrist,NEUTRAL,POSITIVE,NEUTRAL
make them just approve all my contracts i go first buy k suya for myself and iphone for all my baby boys,NEUTRAL,NEUTRAL,NEUTRAL
airpodspro so you can make the battery last all day long,NEUTRAL,NEUTRAL,NEUTRAL
iphone pro max eu vs us price difference is iphone apple,NEUTRAL,NEUTRAL,NEUTRAL
same design bigger cameras what is your favourite iphone pro feature iphonepro iphone iphoneseries https,NEUTRAL,NEUTRAL,NEUTRAL
took the new iphone out shooting did a video too its incredible,POSITIVE,POSITIVE,POSITIVE
which one is newairpodspro,NEUTRAL,NEUTRAL,NEUTRAL
it only works on iphonepromax,NEUTRAL,NEUTRAL,NEUTRAL
is anyone buying iphone iphone,NEUTRAL,NEUTRAL,NEUTRAL
todays lockscreen,NEUTRAL,NEUTRAL,NEUTRAL
always been a kinda gal ever now thinking of switching to iphonepromax samsunggalaxys,NEUTRAL,NEUTRAL,NEUTRAL
fridayfindings are people buying the new apple iphone lifepointspanelsays around in the us will not buy it in the near future does the costofliving crisis make consumers think twice ask our panellists here,NEGATIVE,NEGATIVE,NEGATIVE
apples official magsafe battery pack is amazing,POSITIVE,NEGATIVE,POSITIVE
she fr fatherless tho,NEUTRAL,NEUTRAL,NEUTRAL
buy sweat resistant airpods prond generation from,NEUTRAL,NEUTRAL,NEUTRAL
halloween wallpaper iphone ipad apple watch wallpapers bundle digital download,NEUTRAL,NEUTRAL,NEUTRAL
what about iphone,NEUTRAL,NEUTRAL,NEUTRAL
we all cheered together yayyyyyyyyyyyyyy appleevent apple applelaunchday applewatch,POSITIVE,POSITIVE,POSITIVE
iphone good or bad iphone review today we have iphone review in this blog we are talk about iphone good or bad the iphone are official iphone iphoneseries iphonepro iphonepromax visit this website for complete article,NEUTRAL,NEUTRAL,NEUTRAL
rumored iphone ultra features k video longer battery life larger screen and bigger price,NEUTRAL,NEUTRAL,NEUTRAL
this is wave series wallpaper pack available now at,NEUTRAL,NEUTRAL,NEUTRAL
new product listing for iphonepro iphone iphone apple,NEUTRAL,NEUTRAL,NEUTRAL
looking for a new smartphone check the list of latest smartphones iphone motoedgeultra and many more,NEUTRAL,NEUTRAL,NEUTRAL
ran miles in the indio hills badlands nrc niketrail niketrailrunning nike applewatch applefitnessplus niketrailshoes nikewildhorse nikesegama timetoplay salomon oakley blackdiamondequipment,NEUTRAL,NEUTRAL,NEUTRAL
lets face it if it wasnt for the animations when interacting with dynamic island on the new iphonepro lineup it surely wouldve caused a controversy and many wouldve just stayed with their current device until changes things a bit more,NEGATIVE,POSITIVE,NEUTRAL
here are our thoughts on the new iphone after week apple iphone,NEUTRAL,NEUTRAL,NEUTRAL
iphone whaaaat,NEUTRAL,NEUTRAL,NEUTRAL
iphone satellite connectivity enabled by qualcomm modem and custom appledesigned rf components apple iphone http,NEUTRAL,NEUTRAL,NEUTRAL
the way these airpodspro be booming,NEUTRAL,NEUTRAL,NEUTRAL
apple airpods pro nd generation unboxing apple airpodspro appleairp,NEUTRAL,NEUTRAL,NEUTRAL
some more pics a walk around birmingham birmingham iphonepro shotoniphone ios apple photography brum,NEUTRAL,NEUTRAL,NEUTRAL
mp appleproraw lizard iphonepro photomatix photo for raw editing,NEUTRAL,NEUTRAL,NEUTRAL
taken with the x portrait mode on the iphonepro,NEUTRAL,NEUTRAL,NEUTRAL
aapl spy spx qqq puts apples china icloud operator in the city of guiyang has been shut down under the countrys latest covid lockdown,NEUTRAL,NEUTRAL,NEUTRAL
first pics i took on my iphone pro iphonepro,NEUTRAL,NEUTRAL,NEUTRAL
iphone are now available get yours now __ to order call whatsapp app delivery offered country wide,NEUTRAL,NEUTRAL,NEUTRAL
im very disappointed in the iphone battery life it drains too quick even with having background app refresh off and nothing running review,NEGATIVE,NEGATIVE,NEGATIVE
i hate how ios capitalizes random words like i dont wanna give emphasis to some stupid word in tha sentence get ur self together,NEGATIVE,NEGATIVE,NEGATIVE
the might be wearing applewatch,NEUTRAL,NEUTRAL,NEUTRAL
you can travel to these places around the world at the price of iphone check them out travel iphone iphone iphonepro traveling,NEUTRAL,NEUTRAL,NEUTRAL
about to order some cases for my iphonepromax,NEUTRAL,NEUTRAL,NEUTRAL
iphone keeps calling emergency how to disable this i pressed side button to much,NEGATIVE,NEGATIVE,NEGATIVE
and then what daysofcode iphonepro womenwhocode programming datascience academictwitter serverless iot,NEUTRAL,NEUTRAL,NEUTRAL
if you bought or are planning on buying a new iphone this video will show you how to set it up properly,NEUTRAL,NEUTRAL,NEUTRAL
looks like iphone propro max deliveries are now ranging from october which is a month away appleevent iphone applewatch,NEUTRAL,NEUTRAL,NEUTRAL
iphone pro inches a bionic chip with always on display appleevent,NEUTRAL,NEUTRAL,NEUTRAL
apple watch ultra after being on my wrist for hours applewatchultra,NEUTRAL,NEUTRAL,NEUTRAL
apple lets users uninstall the apple wallet app in the latest beta of ios apple ios iphone,NEUTRAL,NEUTRAL,NEUTRAL
trevi fountain italy iphonepro,NEUTRAL,NEUTRAL,NEUTRAL
say iphonepro,NEUTRAL,NEUTRAL,NEUTRAL
here comes the nerd iphone iphone,NEUTRAL,NEUTRAL,NEUTRAL
here she is iphonepromax,NEUTRAL,NEUTRAL,NEUTRAL
iphone has a feature wherein if you meet with an accident the phone will automatically make emergency calls for,NEUTRAL,NEUTRAL,NEUTRAL
saturday setup wallpaper with blurpaid one mockup widget emerald plusavailable on my,NEUTRAL,NEUTRAL,NEUTRAL
if all the wireless carriers advertise the iphonepro but none of them have any is that falseadvertising,NEUTRAL,NEUTRAL,NEUTRAL
iphone progb spaceblacksilvergold gb spaceblacksilvergolddeeppurple gb deeppurplespaceblackgold tb deeppurplespaceblacksilvergold,NEUTRAL,NEUTRAL,NEUTRAL
cant wait to unbox iphone pro max,NEUTRAL,NEUTRAL,NEUTRAL
memory in summer,NEUTRAL,NEUTRAL,NEUTRAL
boneless chicken thigh night cooked with butter chicken spicy curry sauce by pataks bbq bbqtiktok bbqtiktokscene,NEUTRAL,NEUTRAL,NEUTRAL
you can finally control your apple watch from your iphone with screen mirroring see,NEUTRAL,NEUTRAL,NEUTRAL
the iphone will not feature a physical sim card tray in the us all models will be esim only what do you guys think of,NEUTRAL,NEUTRAL,NEUTRAL
had to spice up the iphone pro max with some self branding iphonepromax shamelessplug,NEUTRAL,NEUTRAL,NEUTRAL
samsung been quiet of mocking apple,POSITIVE,POSITIVE,POSITIVE
iphonepromax forever in amp as,NEUTRAL,NEUTRAL,NEUTRAL
iphone has a new mp main camera appleevent iphone iphonepro iphoneplus iphonepromax,NEUTRAL,NEUTRAL,NEUTRAL
used iphone pro max for sale keh who use am,NEUTRAL,NEUTRAL,NEUTRAL
apple watch ultra amp airpods pro reviews iphone pro indepth,NEUTRAL,NEUTRAL,NEUTRAL
apple iphonepromax is not available in hyderabad waiting time more than month complete mismanagement,NEUTRAL,NEUTRAL,NEUTRAL
iphone is out tim cooked talks about the features iphone,POSITIVE,POSITIVE,POSITIVE
appointment set for monday picking up a couple of iphonepromax purple dont need it but getting it anyways,NEUTRAL,NEUTRAL,NEUTRAL
victory wireless,NEUTRAL,NEUTRAL,NEUTRAL
new video magez case for iphone pro max sleek and thin,NEUTRAL,POSITIVE,NEUTRAL
this cult e ya rona ya ga steve jobsevery year with new devices your devices battery suffers i wont from chargin my phone and watch once every day and half to now atleast once a day i guess iphone it is then i said it its a cult,NEGATIVE,NEGATIVE,NEGATIVE
apple iphone full phone specifications why should you buy it,NEUTRAL,NEUTRAL,NEUTRAL
apple changed how you undo the water lock feature on applewatchseries and its so cool,POSITIVE,POSITIVE,POSITIVE
how to install clockology on your apple watch ultra or series to unlock unlimited faces,NEUTRAL,NEUTRAL,NEUTRAL
iphone iphone plus iphone pro iphone pro max appleevent i am amazed,POSITIVE,POSITIVE,POSITIVE
biggest raw image ive taken so far on the new sensor doughnuts in tim hortons meg iphonepro,NEUTRAL,NEUTRAL,NEUTRAL
apple launched iphone which comes with great futures i personally liked the accident detector,POSITIVE,POSITIVE,POSITIVE
mood iphonepro,NEUTRAL,NEUTRAL,NEUTRAL
have a quick look at the iphonepromax here,NEUTRAL,NEUTRAL,NEUTRAL
did mouse work in iphone facts video is on youtube link,NEUTRAL,NEUTRAL,NEUTRAL
key specification in apple iphone pro max follow apple iphone iphonepromax iphone tech,NEUTRAL,NEUTRAL,NEUTRAL
iphonepro asakemusik loveintheairep check this out,NEUTRAL,NEUTRAL,NEUTRAL
new iphone heres a new wallpaper nftcommunity iphone wallpapers,NEUTRAL,NEUTRAL,NEUTRAL
iphone mystery apple says it plans to fix shaking iphonepro problem is onair now,NEUTRAL,NEUTRAL,NEUTRAL
someone in the comments on youtube said usb type c amp audio headphone jack in the screen iphonepro ios ios iphone dynamicisland,NEUTRAL,NEUTRAL,NEUTRAL
apple watch ultra what you need to know breaks down the new features from a bigger and brighter screen with better battery life to new safety features and an action button are you planning on getting your hands on the applewatchultra,POSITIVE,NEGATIVE,POSITIVE
some ultra wide shots from today iphonepromax shotoniphone,NEUTRAL,NEUTRAL,NEUTRAL
ear tips in new airpods pro incompatible with older model apple airpodspro airpodspro apple,NEUTRAL,NEUTRAL,NEUTRAL
got my new phone and my new action camera iphonepromax goprohero,NEUTRAL,NEUTRAL,NEUTRAL
iphone pro max cameras have a major bug audio and video the digital insider,NEUTRAL,NEUTRAL,NEUTRAL
winn nrealair iphonepro,NEUTRAL,NEUTRAL,NEUTRAL
a chad right here,NEUTRAL,NEUTRAL,NEUTRAL
why i wont be buying apples new iphone apple iphone iphonepro,NEUTRAL,NEUTRAL,NEUTRAL
space black iphonepro apple smartphone shotbypixel,NEUTRAL,NEUTRAL,NEUTRAL
black or purple iphonepro iphonepromax,NEUTRAL,NEUTRAL,NEUTRAL
its just hd fps slow motion with x optical zoom shotoniphone iphonepromax,NEUTRAL,NEUTRAL,NEUTRAL
iphone only,NEUTRAL,NEUTRAL,NEUTRAL
ultrawide and edited iphonepro,NEUTRAL,NEUTRAL,NEUTRAL
you got games on your phone iphonepro,NEUTRAL,NEUTRAL,NEUTRAL
designed in cupertino california by apple iphonepromax apple,NEUTRAL,NEUTRAL,NEUTRAL
dropped new dark green options and has me drooling iphonepromax iphonepro,NEUTRAL,NEUTRAL,NEUTRAL
i guess apples fear marketing didnt work for the new iphone and apple watch preorders appleevent iphonepro applewatch,NEGATIVE,NEGATIVE,NEGATIVE
polltime with techdriveservice trending wednesdaythought iphone cyberpunkedgerunners mov,NEUTRAL,NEUTRAL,NEUTRAL
its official the new airpodspro nd gen is now in stores it may not come with a carabiner but the ubpro does https,NEUTRAL,NEUTRAL,NEUTRAL
applewatchultra danm well ya cant not get it now,POSITIVE,POSITIVE,POSITIVE
unveiling new iphone with mishka iphonepro,NEUTRAL,NEUTRAL,NEUTRAL
right airpodspro where are you outfordelivery,NEUTRAL,NEUTRAL,NEUTRAL
apple watch ultra its big but i love it appleevent applewatchultra,POSITIVE,POSITIVE,POSITIVE
how to turn off or restart iphone iphone pro,NEUTRAL,NEUTRAL,NEUTRAL
absofrigginlutely strikex crypto apple iphone,NEUTRAL,NEUTRAL,NEUTRAL
after first days of pro max usage im noticing less battery backup than my pro max iphone apple ios i,NEUTRAL,NEUTRAL,NEUTRAL
why humanity need always on display on phone iphone,NEUTRAL,NEUTRAL,NEUTRAL
iphone pro max beautiful case iphonecase caseiphone ad explorepag,POSITIVE,POSITIVE,POSITIVE
if you wanna buy iphone ask me first and check my channel in bio,NEUTRAL,NEUTRAL,NEUTRAL
with how this phone is being priced in ghana now the choice is yours apple iphonepro iphone,NEUTRAL,NEUTRAL,NEUTRAL
i love it applewatchultra,POSITIVE,POSITIVE,POSITIVE
new wallpapers for my iphone ios iphonepro dc spiderman,NEUTRAL,NEUTRAL,NEUTRAL
apple iphone repair service in golders green london while you wait repairs website,NEUTRAL,NEUTRAL,NEUTRAL
learn why you should put garlic in your ears before going to bed click the link below for detail,NEUTRAL,NEUTRAL,NEUTRAL
iphone macro setting photography stlphotographer digitalphotography iphonephotography stl stlouis shopsmall smallbusiness art artist vsco shotoniphone iphone iphonepromax macrophotography,NEUTRAL,NEUTRAL,NEUTRAL
busy afternoon unboxing all the iphone and the iphone pro max keep subscribing to the youtube channel,NEUTRAL,NEUTRAL,NEUTRAL
ios iphone icons black mountain wallpaper dark ios icons iphone homescreen theme dark black app icons ios wallpape,NEUTRAL,NEUTRAL,NEUTRAL
this story should be a wakeup call for the us telecom stocks apple testing out emergency satellite services on new ipho,NEGATIVE,NEGATIVE,NEGATIVE
iphonepromax ordered,NEUTRAL,NEUTRAL,NEUTRAL
finally bought this ipad iphonepro sayanipradhan,NEUTRAL,NEUTRAL,NEUTRAL
otofly iphone accessories,NEUTRAL,NEUTRAL,NEUTRAL
apple watch se is feature packed and now its a better value than ever apple applewatchse,POSITIVE,POSITIVE,POSITIVE
first tweet from iphonepromax,NEUTRAL,NEUTRAL,NEUTRAL
same been an iphone pro user somehow decided to up it to the pro max but yea estimated delivery is mid october time to shop for accessories iphonepromax iphone apple,NEUTRAL,NEUTRAL,NEUTRAL
iphone red in our metal magsafe case atomic slim ghostek iphone appleiphone magsafe magsafecase i,NEUTRAL,NEUTRAL,NEUTRAL
specialsummaryrevision visit,NEUTRAL,NEUTRAL,NEUTRAL
unboxing iphone pro max shorts,NEUTRAL,NEUTRAL,NEUTRAL
iphone vs go pro iphonepromax iphonepromax goprohero,NEUTRAL,NEUTRAL,NEUTRAL
first hours with the iphonepro from to battery life with a sot of hours and the alwayson display tur,NEUTRAL,NEUTRAL,NEUTRAL
look what has arrived today to make my weekend beautiful and amazing im extremely grateful to god and apple for this,POSITIVE,POSITIVE,POSITIVE
apple watch ultra gps cellular mm titanium case with starlight alpine loop medium applewatchultra applewatch paymonthly,NEUTRAL,NEUTRAL,NEUTRAL
what are amp doing at their table texting each other tct iphone,NEUTRAL,NEUTRAL,NEUTRAL
the new apple watch series unveiled at last weeks appleevent features a axis gyroscope,NEUTRAL,NEUTRAL,NEUTRAL
cynthia and iphone,NEUTRAL,NEUTRAL,NEUTRAL
kerala youth flies to dubai to buy iphone hours before india launch,NEUTRAL,NEUTRAL,NEUTRAL
iphone some of us havent used any of them appleevent,NEGATIVE,NEGATIVE,NEGATIVE
took this photo with the iphonepromax raw format then edited it in lightroom,NEUTRAL,NEUTRAL,NEUTRAL
the iphonepro space black tho,NEUTRAL,NEUTRAL,NEUTRAL
here are they airpodspro,NEUTRAL,NEUTRAL,NEUTRAL
iphone covers and other productsclick the link to shop,NEUTRAL,NEUTRAL,NEUTRAL
inc may make one out of four iphones in india by analysts said as the tech giant moves some prod,NEUTRAL,NEUTRAL,NEUTRAL
fairly used iphonepromax for sale face id working battery health nk who fairly used it,NEUTRAL,NEUTRAL,NEUTRAL
iphone se now starts selling hot in india appleevent,POSITIVE,POSITIVE,POSITIVE
after wearing the apple watch ultra for the last hours i definitely think the series is more comfortable and the galaxy gear pro is much more comfortable as well applewatchultra,POSITIVE,NEGATIVE,NEUTRAL
hello test iphonepromax queen sirikit national convention center,NEUTRAL,NEUTRAL,NEUTRAL
festiveseason is coming and the smartphone market expects to receive record sales within to weeks in the coming months india expects a whopping billion in smartphone sales visit,NEUTRAL,NEUTRAL,NEUTRAL
ordered the new iphonepromax ill have to wait a bit but thats fine will be worth it signed up for the appleupgradeprogram hope i made the right decision ive always bought them straight up thats why i still have the promax will be nice to upgrade more often,NEUTRAL,NEUTRAL,NEUTRAL
apple watch bracelet,NEUTRAL,NEUTRAL,NEUTRAL
is iphone available how much,NEUTRAL,NEUTRAL,NEUTRAL
my baby has arrived iphonepromax,NEUTRAL,NEUTRAL,NEUTRAL
iphone pro window display,NEUTRAL,NEUTRAL,NEUTRAL
yall jus gotta know im cooking up aespa shehulk dolar blacktwitter krkarrested mancity mwii rushhour tworldcup tiktokdown iphone pinkvenom zevent vijaydeverakonda tozluyaka yinyin_anw queenelizabethiimemorial,NEUTRAL,NEUTRAL,NEUTRAL
me using the mindfulness breathing app on applewatch after having my th breakdown of the day applewatch applewatchseries apple applewatchpro applewatchse,NEUTRAL,NEUTRAL,NEUTRAL
got my dynamic island iphone iphonepro shotoniphone,NEUTRAL,NEUTRAL,NEUTRAL
anybody know where the app for the face scan is im on apple and i cant find it in the app store,NEUTRAL,NEUTRAL,NEUTRAL
vodacom iphone iphone pro and iphone pro max contract deals iphone iphonepro iphonepromax preorder contract apple mobile vodacom ios tech technews technology southafrica durban capetown johannesburg,NEUTRAL,NEUTRAL,NEUTRAL
now you can see airpods pro battery all the time i havent opened the case since last night airpodspro,NEUTRAL,NEUTRAL,NEUTRAL
inflation in turkey seven years ago lira got you a car today it gets you a phone imagine what is happening with your saving when you dont invest start trading with us,NEUTRAL,NEUTRAL,NEUTRAL
places you can visit in india rather than buying an iphonepro everywhere iphone iphoneonflipkart travel travelwithtrainman trainman meme thoughtoftheday thursdayvibes,NEUTRAL,NEUTRAL,NEUTRAL
and some people still think only apple decides the song in the country,NEUTRAL,NEUTRAL,NEUTRAL
apple watch ultra approved by local honey bee applewatchultra,POSITIVE,POSITIVE,POSITIVE
magsafe case for iphone pro max iphonepromax iphonecase phonecase iphoneaccessories magneticphonecase magsafecase magneticcase phonecasefactory,NEUTRAL,NEUTRAL,NEUTRAL
i made a movie with the new iphonepro and im not gonna shut up about it until everyone sees it if it spoke to yo,NEUTRAL,NEUTRAL,NEUTRAL
dynamic island pretty good idea and act but is it that great actually iphone dynamicisland ios,POSITIVE,NEGATIVE,NEUTRAL
me to when hes going to get iphonepromax alygoni famaly,NEUTRAL,NEUTRAL,NEUTRAL
going beyond plus ultraaa i mean beyond x iphonepromax shotoniphone britishcolumbia canada okanagan kelowna nightphotography,NEUTRAL,NEUTRAL,NEUTRAL
hb using apples iphone bugs oops i meant undocumented features,NEUTRAL,NEUTRAL,NEUTRAL
watch the commuter case for the iphone pro max get unboxed here,NEUTRAL,NEUTRAL,NEUTRAL
the way i live for purple and green and this new deep purple colour is very tempting to start with iphonepro,NEUTRAL,NEUTRAL,NEUTRAL
currently buying rushhour caterefe wizkid nans machala airport mr money iphone cart,NEUTRAL,NEUTRAL,NEUTRAL
iphone pro max vs iphone pro which should you buy review video is out now,NEUTRAL,NEUTRAL,NEUTRAL
why new widgets dont work with old wallpapers ios ios appleevent,NEUTRAL,NEGATIVE,NEGATIVE
got that new iphonepro or iphone check out this dope wallpaper pack make that oled glow with all these colors,NEUTRAL,NEUTRAL,NEUTRAL
ios photos app features in iphones,NEUTRAL,NEUTRAL,NEUTRAL
fully tested iphone crash detection on youtube,NEUTRAL,NEUTRAL,NEUTRAL
more here,NEUTRAL,NEUTRAL,NEUTRAL
calculate your heart rate recovery post workout using watchos fitness app,NEUTRAL,NEUTRAL,NEUTRAL
i still dont think far what do you mean about uk used pro max just released and you are asking for uk used atear iphone,NEUTRAL,NEUTRAL,NEUTRAL
iphone evolution apple iphone iphonepromax iphone iphone tech,NEUTRAL,NEUTRAL,NEUTRAL
i pro max gb ram tb storage mpmp mah clone iphoneproonamazon iphonepromax,NEUTRAL,NEUTRAL,NEUTRAL
iphonepromax ???,NEUTRAL,NEUTRAL,NEUTRAL
apple ipad air inch gb tablet gold renewed appleipad apple appleipadpro ipadair appleipadmini ipa,NEUTRAL,NEUTRAL,NEUTRAL
breaking first time over a years rihanna amp apple announced to lead the most highprofile performance beautiful artist rihanna superbowllvii appleevent,POSITIVE,POSITIVE,POSITIVE
the same motion sensors have been used in the applewatch appleevent applewatchse,NEGATIVE,NEGATIVE,NEGATIVE
do you touch or use iphone pro iphonepro,NEUTRAL,NEUTRAL,NEUTRAL
i got the iphonepromax today holy crap i am so in love with it but wont use it until i get a damn case,POSITIVE,NEGATIVE,NEUTRAL
grabpic merge card bybitnft,NEUTRAL,NEUTRAL,NEUTRAL
how to remotely lock your apple watch iphone mac amp ipad,NEUTRAL,NEUTRAL,NEUTRAL
iphone whats new watch the video to know more apple iphoneseries,NEUTRAL,NEUTRAL,NEUTRAL
apple vs nothing phone which one i prefer most apple,NEUTRAL,POSITIVE,POSITIVE
applewatch running power data comparison to garmin stryd polar amp coros apple watch,NEUTRAL,NEUTRAL,NEUTRAL
iphone battery life test does it really last all day long,NEUTRAL,NEGATIVE,NEUTRAL
oh my word the camera tech for the iphone line thats it thats the tweet,NEUTRAL,NEUTRAL,NEUTRAL
we can record our life in web college combine my bayc with a shirt rookie employee dress my bayc in a suit,NEUTRAL,NEUTRAL,NEUTRAL
never preordering a phone from you guys ever again you take around years to give your customer the device iphonepro,NEUTRAL,NEGATIVE,NEGATIVE
street kittens and their mom mowing and ask for cat food,NEUTRAL,NEUTRAL,NEUTRAL
apple stay turning my headphones down every minutes,POSITIVE,POSITIVE,POSITIVE
ios beta slightly revamps the battery icon amp animations apple ios iphone,NEUTRAL,NEUTRAL,NEUTRAL
airpods pro nd generation has arrived airpodspro,NEUTRAL,NEUTRAL,NEUTRAL
iphonepromax space black,NEUTRAL,NEUTRAL,NEUTRAL
after updating im now getting random camera shakes iphonepromax,NEUTRAL,NEUTRAL,NEUTRAL
this you,NEUTRAL,NEUTRAL,NEUTRAL
green apples kashmir photooftheday photos naturephotography photographer nature naturelov,NEUTRAL,NEUTRAL,NEUTRAL
a recent test revealed the iphone pro max charging speed of w and w for iphone read more,NEUTRAL,NEUTRAL,NEUTRAL
make we no lie iphone no expensive na u no wan buy two iphone iphone ios apple,NEGATIVE,NEUTRAL,NEGATIVE
is it really necessary to have so many iphone videos published today reviewing the same thing are all the tech youtubers running out of ideas,NEUTRAL,NEUTRAL,NEUTRAL
airpodspro allows user to monitor the battery percentage of the case when the headset is not included,NEUTRAL,NEUTRAL,NEUTRAL
you are going to iphone iphone iphonepro just remember to buy solar backup system you never know loadshedding might go to stage,NEUTRAL,NEUTRAL,NEUTRAL
i did say i wont be on twitter until october i had to show this ive replaced the iphonepromax for the new iphon,NEUTRAL,NEUTRAL,NEUTRAL
apple iphone series best quality protective case amp covers are on the trending dealoftheday iphone iphonepro iphonepromax iphoneplus get at big discounts,POSITIVE,NEUTRAL,POSITIVE
looks like the new ipad pro and might be equipped with the same chip which we had seen on the new macbook air and pro cant wait to see this on mid of october apple event apple appleevent ipad ipadpro ipados,NEGATIVE,NEGATIVE,NEGATIVE
apple watch ultra is truly amazing i do wish apple would open up being able to play music on it via the speaker lightweight trekking where you carry only essential camping overnight but still able to listen to musicpodcast playing on your wrist applewatchultra,POSITIVE,POSITIVE,POSITIVE
splatoon switch pro iphonepro,NEUTRAL,NEUTRAL,NEUTRAL
settings to check out on iphone pro photos coverage promacrumorshere camera mpiphone iphonepro,NEUTRAL,NEUTRAL,NEUTRAL
i dont wear these often bc i live in my applewatch but from to i get dressed up and put one of these on,NEUTRAL,NEUTRAL,NEUTRAL
todays inspo for iphone pro iphonepro iphoneseries iphoneprocamera,NEUTRAL,NEUTRAL,NEUTRAL
