tweet,label_1,label_2,final_label
transforming smikes on a daily uganda kampala iphonepromax queenelizabethii captaincy foryou viral de,NEUTRAL,NEUTRAL,NEUTRAL
check iphone iphonecases dprint rhino,NEUTRAL,NEUTRAL,NEUTRAL
fix to camera bug of iphone pro and pro max to be rolled out next week,NEUTRAL,NEUTRAL,NEUTRAL
looks like im already a bit late to unboxing this apple watch ultra but i got an interesting idea for this first video that i think only a tech lover watch lover will appreciate stay tuned applewatchultra,POSITIVE,NEGATIVE,POSITIVE
iphone production begins in india at foxconn facility near chennai,POSITIVE,POSITIVE,POSITIVE
unboxing the iphone and iphonepromax,NEUTRAL,NEUTRAL,NEUTRAL
you change caller id on your iphone in a few seconds heres how you can do it in a very short interval of time without going to an expert read,NEUTRAL,NEUTRAL,NEUTRAL
iphonepromax video montage ft full video on youtube,NEUTRAL,NEUTRAL,NEUTRAL
iphone models hit malaysian shores,NEUTRAL,NEUTRAL,NEUTRAL
apple maintains prices on new iphones despite inflation,NEUTRAL,NEUTRAL,NEUTRAL
testing the new iphonepro camera,NEUTRAL,NEUTRAL,NEUTRAL
regular people application of the waypoint compass feature on apple watch ultra to retrace your steps back to your usually undiscoverable parking spot at disneyworlduniversal studios applewatchultra waypoints,NEUTRAL,NEUTRAL,NEUTRAL
unboxing the apple iphone pro max in space black,NEUTRAL,NEUTRAL,NEUTRAL
whoop whoop applewatchultra,NEUTRAL,POSITIVE,NEUTRAL
my first new iphone in nearly years i introduce you to the iphonepromax in deeppurple,NEUTRAL,NEUTRAL,NEUTRAL
pairing screen applewatchseries graphiteapplewatch applewatchgraphite graphitestainlesssteelapplewatch apple watch graphitestainlesssteel apple stainlesssteelapplewatch applewatch applewatchstainlesssteel gymredbrightcrimsonnikesportband,NEUTRAL,NEUTRAL,NEUTRAL
iphone plus th generation iphone iphonethgen iphoneplus,NEUTRAL,NEUTRAL,NEUTRAL
mint xsmax gb k only iphonepromax queensfuneral jhope,NEUTRAL,NEUTRAL,NEUTRAL
only iphone i can afford flipkartbigbilliondays iphonepro iphone flipkart,NEUTRAL,NEUTRAL,NEUTRAL
the new style is online welcome to choose on,POSITIVE,POSITIVE,POSITIVE
space black iphone pro max unboxing and apple watch ultra uses new stc listen,NEUTRAL,NEUTRAL,NEUTRAL
new song iphone out now featuring wya woogie trending iphone iphone,NEUTRAL,NEUTRAL,NEUTRAL
bosslady has a message for you cc thebbmafrica hoursreal,NEUTRAL,NEUTRAL,NEUTRAL
i made an iphone pro review from my perspective as a travel photographer,NEUTRAL,NEUTRAL,NEUTRAL
iphone pro camera with night mode iphonepro,NEUTRAL,NEUTRAL,NEUTRAL
im gonna sell my iphone to upgrade to iphone mini not buying iphone im a small phone person iphonepro,NEGATIVE,NEUTRAL,NEGATIVE
iphone pro by myself modelling texturing animation everything by myself on blender,NEUTRAL,NEUTRAL,NEUTRAL
now the lock screen on my iphonepro displays the next two items on the grocery list plus the icon of the app i use that synchs with the family phones so we can update the list at any time its great you should check it out,POSITIVE,POSITIVE,POSITIVE
had to get purple for my iphone iphone iphonepromax raw tuesdayvibe,NEUTRAL,NEUTRAL,NEUTRAL
morning insight tuesdayinsight ukused iphone iphone ios lekki aja sangotedo lagos smartphones computervillage homedelivery quality laptops applemusic lautech unilag laspotechikorodu futafuta gadgets,NEUTRAL,NEUTRAL,NEUTRAL
with more battery life the new airpods pro are next level,POSITIVE,POSITIVE,POSITIVE
a hotel in west hollywood iphonepromax,NEUTRAL,NEUTRAL,NEUTRAL
ad off anker wireless charging station usa,NEUTRAL,NEUTRAL,NEUTRAL
apple readies ios bug fix for next week apple camerabehavior iosbugfix iphonepro socialmediaapps technology,NEUTRAL,NEUTRAL,NEUTRAL
anybody got the iphone yet,NEUTRAL,NEUTRAL,NEUTRAL
paul cleverlee na mad guy carter efe finally got to sing watch and enjoy carterefe berritiga cruise messi,NEUTRAL,NEUTRAL,NEUTRAL
or pro iphone apple choices,NEUTRAL,POSITIVE,NEUTRAL
they took the chronic off apple music,NEUTRAL,NEUTRAL,NEUTRAL
sunset on dartmoor last night bowermans nose iphonepromax hdr,NEUTRAL,NEUTRAL,NEUTRAL
apple event tonight at pm ist far out iphone plus pro pro max apple watch pro next gen apple a,NEUTRAL,NEUTRAL,NEUTRAL
forget photoshop ios lets you paste photo cutouts to any background you want as long as you know this hidden trick do it on your iphone,NEUTRAL,NEUTRAL,NEUTRAL
spill ootd instagram on shopee under k blouse,NEUTRAL,NEUTRAL,NEUTRAL
question would you get the iphone or wait for the iphone plus anyways the iphone is available,NEUTRAL,NEUTRAL,NEUTRAL
all iphonepro and iphonepromax devices at the dubai mall store were either reserved or sold just minutes after sales began long queues snaked outside the store as hundreds of people lined up to get their hands on the brandnew iphone that went on sale in uae,NEUTRAL,NEUTRAL,NEUTRAL
apple iphone pro max apple iphone pro max smartphone announced sep features display apple a bionic chipset mah battery gb storage size inches cm internal gb gb ram gb gb ram smartphone iphone pro,NEUTRAL,NEUTRAL,NEUTRAL
iphone pro and pro max negative review roundup a trip to dynamic island,NEGATIVE,NEGATIVE,NEGATIVE
new video full grain leather iphone case iphonepro iphoneseries caselife,NEUTRAL,NEUTRAL,NEUTRAL
do you know that the first three letters on all lagos state plate numbers are name after the local governments quee,NEUTRAL,NEUTRAL,NEUTRAL
looking to get an iphone series phone with tmt by thunder match heres a midnight unveiling for you tmtbythundermatch onlyattmt iphonepro iphonepromax technave,NEUTRAL,NEUTRAL,NEUTRAL
iphonepro photo test shot with developed with,NEUTRAL,NEUTRAL,NEUTRAL
the deep purple iphonepro very headturning,NEGATIVE,NEGATIVE,NEGATIVE
if i trade in my samsung s ultra g i get the iphone pro for should i,NEUTRAL,NEUTRAL,NEUTRAL
book us now shutdown iphonepro,NEUTRAL,NEUTRAL,NEUTRAL
not me planning but stucked between iphone or samsung flip,NEUTRAL,NEUTRAL,NEUTRAL
ios allows switch controllers on idevices iphone iphone ios ios iosupdate iosupdate iphoneupdate sonic sonicthehedgehog mobilegames controller joycons procontroller switch switchcontroller shadowsmm apple idevice nintendo,NEUTRAL,NEUTRAL,NEUTRAL
for sale land size hectares location guzape abujafct purpose commercial title fcda c of o net priceb,NEUTRAL,NEUTRAL,NEUTRAL
wallpapers homescreen iphonepromax iphonepro iphoneplus iphone iphonepromax iphonepro iphone iphonepromax iphonepro iphone android download,NEUTRAL,NEUTRAL,NEUTRAL
where the fix for the camera iphonepromax,NEUTRAL,NEUTRAL,NEUTRAL
some new iphone features will only be coming to the iphonepro line,NEUTRAL,NEUTRAL,NEUTRAL
apple watch series appleevent,NEUTRAL,NEUTRAL,NEUTRAL
havent you updated your playlist yet just dropped another banger soja check it out sarkodie shattawal,NEUTRAL,NEUTRAL,NEUTRAL
new video the x tele is back so how is the dof iphonepromax watch,NEUTRAL,NEUTRAL,NEUTRAL
manifesting wondershare iphone nothingchangedaftertransfer mobiletrans ios iphone,NEUTRAL,NEUTRAL,NEUTRAL
some cases get greasy and uncomfortable to touch sorry you need to do better iphonepromax apple ht,NEUTRAL,NEUTRAL,NEUTRAL
iphone pro camera is really quite good in richness and quality even in dark photos come out mint long exposure iphonepro apple,POSITIVE,POSITIVE,POSITIVE
x x x x iphonepromax,NEUTRAL,NEUTRAL,NEUTRAL
had to do it cam iphonepromax,NEUTRAL,NEUTRAL,NEUTRAL
yayyyy and or verizon have the supply in order to ship by iphone i ordered september th cant wait for my new iphonepromax apple iphone preorder,NEUTRAL,NEUTRAL,NEUTRAL
breaking a day after appleevent garmin is facing a server outage,NEUTRAL,NEUTRAL,NEUTRAL
iphone pro max frequent camera issue when using messenger and iphonepromax,NEUTRAL,NEUTRAL,NEUTRAL
apple iphone pro repair service in golders green london website,NEUTRAL,NEUTRAL,NEUTRAL
why did you remove the app for applewatch,NEUTRAL,NEUTRAL,NEUTRAL
i cycled outdoors for mi with the workout app on my applewatch still working on pedaling off the beer tank,NEUTRAL,NEUTRAL,NEUTRAL
brand new iphone abs promax iphonepromaxrelease iphonepromaxcolors iphonepromaxfeatures iphonepromaxdeeppurple iphonepromaxcase iphonepromaxprice iphonepromaxtmobile iphone,NEUTRAL,NEUTRAL,NEUTRAL
icymi the dynamic island was one of key highlights on the apple iphone pro and iphone pro max allowing using,POSITIVE,NEUTRAL,POSITIVE
barcode sister bought an iphone for barcode the real big sister money,NEUTRAL,NEUTRAL,NEUTRAL
the previous version was also a dented this time its a black hole hmmmm will watch the series in full screen and then theres this hole appleevent iphonepromax iphonepro,NEUTRAL,NEUTRAL,NEUTRAL
airpods pro ndgeneration engraving displays on iphone while pairing apple airpodspro iphone visit article,NEUTRAL,NEUTRAL,NEUTRAL
airpods pro airpods pro second generation,NEUTRAL,NEUTRAL,NEUTRAL
pilots are famous for preferring chonky watches chonky watch acquired applewatchultra,NEUTRAL,POSITIVE,POSITIVE
apple iphone pro max gb gold unlocked renewed,NEUTRAL,NEUTRAL,NEUTRAL
i bet more than of the applewatchultra users in india will use it as a normal smartwatch instead of the main purpose it is specifically designed for ie scuba diving trekking hiking,POSITIVE,NEGATIVE,NEUTRAL
this is huge news appleevent,POSITIVE,POSITIVE,POSITIVE
airpods with apple tv how to,NEUTRAL,NEUTRAL,NEUTRAL
space black amp umber are the colours this time iphonepro,NEUTRAL,NEUTRAL,NEUTRAL
iphonepro has faster g uploaddownload speeds than the pro with peak g download speeds of mbps on tmobile vs pros mbps macrumors,NEUTRAL,NEUTRAL,NEUTRAL
the low light photos on the iphonepro are seriously impressive i dont even care for low light photos but these shots inside the chinese theater are impressive teamtcl,POSITIVE,POSITIVE,POSITIVE
apple iphonepromax yo this apple store is packed but im about to get my pro max soon being helped now,NEUTRAL,NEUTRAL,NEUTRAL
i dont miss iphonepro dynamicisland,NEGATIVE,NEGATIVE,NEGATIVE
apple iphone series readily available callwhatsapp email enquiries website,NEUTRAL,NEUTRAL,NEUTRAL
excited about the iphone here are some of the new features android did first iphone android apple,POSITIVE,POSITIVE,POSITIVE
register and earn per day posting memes download on appstore,NEUTRAL,NEUTRAL,NEUTRAL
hey verizon if youre gonna charge me to activate on my own my new iphone at least update my devices section on your website to an phone,NEUTRAL,NEUTRAL,NEUTRAL
should i open it iphonepro,NEUTRAL,NEUTRAL,NEUTRAL
how was the iphonepromax after being in water,NEUTRAL,NEUTRAL,NEUTRAL
none of our pakistani content creators can deposition iphonepro,NEUTRAL,NEUTRAL,NEUTRAL
lackrule plum silicone back cover compatible for iphone order on whatsapp,NEUTRAL,NEUTRAL,NEUTRAL
cpid x cprv x bdid x ecid xxxxxxxxxxxxxxx cpfm x scep x ibfl xc srtg iboot nonc aabeefaefaaaeeabeba snon fababdfddcfadc mode dfu product iphone model dap name iphone,NEUTRAL,NEUTRAL,NEUTRAL
the iphonepros dynamic island isnt very dynamic for me with a distracting design and limited app availability it hasn,NEGATIVE,NEGATIVE,NEGATIVE
a new iphone has just hit the market and techinsights sme stacy wegner has the initial teardown analysis on whats different this year iphone iphonepro iphonepromax ios,NEUTRAL,NEUTRAL,NEUTRAL
check out my latest article about iphone iphone iphonesetting resetiphone iphonesettings,NEUTRAL,NEUTRAL,NEUTRAL
woah the iphonepromax camera is a killer with astrophotography my old pro max couldve never done this big dipper constellation,POSITIVE,POSITIVE,POSITIVE
just apple things apple applewatch applewatch,NEUTRAL,NEUTRAL,NEUTRAL
iphone launch live blog reviews deals and everything you need to know,NEUTRAL,NEUTRAL,NEUTRAL
i am a techkey we have the iphone pro in the house going to be taking a lot of photos with it to check its camera capabilities productphotography keyboard mechanicalkeyboard iphonepro dynamicisland photooftheday photography photographer photo,NEUTRAL,NEUTRAL,NEUTRAL
heres everything you need to know about the new iphone and pro,NEUTRAL,NEUTRAL,NEUTRAL
you can grab the all new iphone at a much cheaper rate by using this apple store trick here is all you need to know about how apple tradein works,NEUTRAL,NEUTRAL,NEUTRAL
even the iphone had its back modified in so that it had a glowing apple logo iphone,NEUTRAL,NEUTRAL,NEUTRAL
finally iphone iphonepromax,NEUTRAL,NEUTRAL,NEUTRAL
airpods user guide and tutorial,NEUTRAL,NEUTRAL,NEUTRAL
iphone pro max unboxing shorts apple iphonepromax,NEUTRAL,NEUTRAL,NEUTRAL
so i have the iphone promax i was debating if i should get the iphone pro max and silver or gold should i just go ahead and upgrade appleevent iphonepromax,POSITIVE,POSITIVE,POSITIVE
night shots day iphonepromax williamsport pennsylvania,NEUTRAL,NEUTRAL,NEUTRAL
apparently the iphone pros truedepth camera assembly is two separate modules with a bit of the oled panel in the mid,NEUTRAL,NEUTRAL,NEUTRAL
i am recording in touch with ios live tonight with iphone airpodspro and applewatch all out or will be we discuss,NEUTRAL,NEUTRAL,NEUTRAL
reasons why you should get the iphone propro max,NEUTRAL,NEUTRAL,NEUTRAL
will you be picking up the new iphone apple now has an iphone for almost every wallet starting with the budgetf,NEUTRAL,NEUTRAL,NEUTRAL
new photos from iphonepro edited in lightroom insane what phones can do now,POSITIVE,POSITIVE,POSITIVE
apple iphone pro max price in bangladesh learn more,NEUTRAL,NEUTRAL,NEUTRAL
hows the iphonepro i got the pro maxi was thinking about getting that thick tb one,NEUTRAL,NEUTRAL,NEUTRAL
iphone pro deep purple unboxing and setupvideo is out now,NEUTRAL,NEUTRAL,NEUTRAL
if thats the case amp history is repeating itself then we should be expecting to see our first iphone blow up in somebodys hands,NEUTRAL,NEUTRAL,NEUTRAL
go go iphonepro apple esim,NEUTRAL,NEUTRAL,NEUTRAL
mondaze iphonepromax,NEUTRAL,NEUTRAL,NEUTRAL
quick test shot on iphonepromax x x x and digital zoom bttower,NEUTRAL,NEUTRAL,NEUTRAL
damn you powerful business for making things cost so darn much hold on how do i turn off spell check on my new iphone,NEGATIVE,NEGATIVE,NEGATIVE
this happens everytime iphone iphonepro iphoneultra thursdayvibes,NEUTRAL,NEUTRAL,NEUTRAL
i see there,NEUTRAL,NEUTRAL,NEUTRAL
testing out new action mode on the iphone,NEUTRAL,NEUTRAL,NEUTRAL
applewatch on twitter,NEUTRAL,NEUTRAL,NEUTRAL
airpods pro user guide and tutorial,NEUTRAL,NEUTRAL,NEUTRAL
fptech you can also personalize your iphone alwayson display by designing your iphonelockscreen with photos from the gallery customised wallpapers stylish fonts colours and iphonewidgets apple iphonepromax,NEUTRAL,NEUTRAL,NEUTRAL
i agree with those who say the new applewatchultra is good but not good enough id wait for rev before it is good enough the action button is far too easy to press and theres no way to cancel that press,POSITIVE,POSITIVE,POSITIVE
lively scenes at stores this morning for applewatchultra launch,POSITIVE,POSITIVE,POSITIVE
at words this could be the longest iphone pro review you read but given how much is in this phone we needed to say a lot of things find out what we have to say on apples latest premium phone,NEUTRAL,NEUTRAL,NEUTRAL
apple iphone pro deep purple appleevent iphone unboxing deeppurple dynamicisland,NEUTRAL,NEUTRAL,NEUTRAL
onto the main event iphonepro minimal plastic so far,NEUTRAL,NEUTRAL,NEUTRAL
some randoms iphonepromax shotoniphone britishcolumbia canada okanagan kelowna nightphotography,NEUTRAL,NEUTRAL,NEUTRAL
anyone in the iphone lt camp iphonepro iphone iphonepromax iphone,NEUTRAL,NEUTRAL,NEUTRAL
apple store central world applestorecentralworld applestore shotoniphone iphonepromax bangkok thailand ratchaprasong centralworld apple store central world,NEUTRAL,NEUTRAL,NEUTRAL
iphone is exactly the same appleevent apple iphone,NEGATIVE,NEGATIVE,NEGATIVE
make your lock screen weather aware with rainviewer follow the steps in our video tutorial,NEUTRAL,NEUTRAL,NEUTRAL
you have l you buy a house say for l on down even if re may move at per year and have a rental yield of,NEUTRAL,NEUTRAL,NEUTRAL
this is raw video from a demo i did explaining how cinematicmode really works on the iphonepro and iphonepromax,NEUTRAL,NEUTRAL,NEUTRAL
iphone amp users meeting after launching of iphone eget why,NEUTRAL,NEUTRAL,NEUTRAL
launch day happiness with the ultra applewatchultra st impression its gorgeous,POSITIVE,POSITIVE,POSITIVE
something you are not seeing or being told is that you can use the magsafe battery pack to charge your airpods airpodspro apple,NEUTRAL,NEUTRAL,NEUTRAL
after wearing the apple watch ultra for the last hours i definitely think the series is more comfortable and the garmin,POSITIVE,POSITIVE,POSITIVE
pta charging rs tax on iphone pro max digitalmore pakistan tax iphonepromax iphone iphonepro iphones,NEUTRAL,NEUTRAL,NEUTRAL
i hit my daily move goal for the th time on my applewatch,NEUTRAL,NEUTRAL,NEUTRAL
case for iphone pro max phone cover accessori i link,NEUTRAL,NEUTRAL,NEUTRAL
applewatchapplewatch,NEUTRAL,NEUTRAL,NEUTRAL
the very first sale of apple iphone pro max in kerala to by managing director of mobile king mohammad fayas,NEUTRAL,NEUTRAL,NEUTRAL
half the people using the apple watch ultra arent even in its target audience appleevent applewatchultra,NEGATIVE,NEGATIVE,NEGATIVE
could i order the iphonepromax from your store today atampt service all in person,NEUTRAL,NEUTRAL,NEUTRAL
when asked about interoperability issues tim cook says this there are no interoperability issues everybody just has to bu,NEUTRAL,NEUTRAL,NEUTRAL
iphone is so boring cant wait for the appleevent,POSITIVE,NEUTRAL,NEUTRAL
let the transfer begin iphone,NEUTRAL,NEUTRAL,NEUTRAL
after a gap of years i am again if the opinion that this world is not divided upon the cast creed or colourthere only types of people exist in this word those who use iphone amp those who dontsimple iphone,NEUTRAL,NEUTRAL,NEUTRAL
apple watch series mm gps off,NEUTRAL,NEUTRAL,NEUTRAL
equinox does not have a touch screen stylus sold separately,NEUTRAL,NEUTRAL,NEUTRAL
follow amp retweet done nrealair iphonepromax,NEUTRAL,NEUTRAL,NEUTRAL
add my iphonepro to the list of reported camera issues thanks apple im gonna stick to my cameragate iphonepromax cameraissue,NEGATIVE,NEGATIVE,NEGATIVE
jpegs shot and edited by me myself and i contact me for bookings sacked klopp liverpool osimhen liv,NEUTRAL,NEUTRAL,NEUTRAL
buy or swap your iphone for a higher version all types available xr gb gb pro max gb x gb pro,NEUTRAL,NEUTRAL,NEUTRAL
if you are a young girl you are using iphone pro max and iphone pro max and you dont have anything you are doing,NEUTRAL,NEUTRAL,NEUTRAL
best of the day on,POSITIVE,POSITIVE,POSITIVE
the apple watch ultra is the true meaning of chefs kiss well done this is the watch ive been waiting for applewatchultra,POSITIVE,POSITIVE,POSITIVE
free iphone giveaway all you gotta do is like share it and tag friends also have to pay for shipping iphone iphonegiveaway iphonesauce iphonesauce,NEUTRAL,NEUTRAL,NEUTRAL
have you picked up your new iphone check out the latest deal on our all new iphone insurance iphone apple,NEUTRAL,NEUTRAL,NEUTRAL
i phone pro max iphone iphonepromax iphonepro iphoneproca,NEUTRAL,NEUTRAL,NEUTRAL
thinking about the getting the new iphone pro max and the series watch is it worth it appleevent iphone phones,NEUTRAL,NEUTRAL,NEUTRAL
iphonepro a rate con windtre,NEUTRAL,NEUTRAL,NEUTRAL
applewatch techcrunch is part of the yahoo family of brands,NEUTRAL,NEUTRAL,NEUTRAL
wow iphonepro has the absolute worst battery life on an iphone that i have ever experienced set up as newturned off always on display its really bad returning and ordering the larger size in hopes it lasts longer,NEGATIVE,NEGATIVE,NEGATIVE
it arrived iphonepromax,NEUTRAL,NEUTRAL,NEUTRAL
what have i done got the apple iphonepromax lets see if its worth the hype got the new color thanks to,NEUTRAL,NEUTRAL,NEUTRAL
hello sir i part of some giveaway offers but my dream to buy iphonepromax but i cant buy some financial problem but one day i buying iphonepromax series so you can giveaway for me thebigbilliondays iphoneonflipcart sir u can giveme,NEUTRAL,NEUTRAL,NEUTRAL
im next up i just need a ear to listen singer rapper songwriter singer naptown iphonepro unsigned rap,NEUTRAL,NEUTRAL,NEUTRAL
ios wallpaper collection ios ios iphone apple iphone,NEUTRAL,NEUTRAL,NEUTRAL
new podcast episode on this episode we talk about gta gameplay leaks applewatchultra reviews the upcoming goo,NEUTRAL,NEUTRAL,NEUTRAL
we are live recording and talking appleevent,NEUTRAL,NEUTRAL,NEUTRAL
another undisclosed feature of airpodspro the laser engraving will be displayed directly on the connection interface ht,NEUTRAL,NEUTRAL,NEUTRAL
ramsetu the most anticipated film of this year a film that will introduce us to many unheard aspects related to ra,NEUTRAL,NEUTRAL,NEUTRAL
iphone pro max and iphone is available dm for the price,NEUTRAL,NEUTRAL,NEUTRAL
hours later and the battery is still going strong so impressed applewatchultra,POSITIVE,POSITIVE,POSITIVE
charger to box me hoga nhii too wo maine order kr diya haii iphone iphonepro iphonegiveaway,NEUTRAL,NEUTRAL,NEUTRAL
every time i think about buying the new iphonepro savings moneymanagement fintech savewithsav,NEUTRAL,NEUTRAL,NEUTRAL
same for the iphonepromax,NEUTRAL,NEUTRAL,NEUTRAL
all new and amazing apple watch ultra price appleevent applewatchultra,POSITIVE,POSITIVE,POSITIVE
hr later and is still down for orders appleevent,NEUTRAL,NEUTRAL,NEUTRAL
angles amp colorful skys rushhour rickandmorty boston streetphotography iphonepromax photography photooftheday,NEUTRAL,NEUTRAL,NEUTRAL
early night photography with the iphone pro max apple luminarneo iphonepromax robleephotography tapestry g,NEUTRAL,NEUTRAL,NEUTRAL
thankyou for putting back the battery percentage on the new software update to my iphone pro max i expect its the same on iphone pro max i havent received yet iphonepromax iphoneupdate iphonepromax applebackup,NEUTRAL,NEUTRAL,NEUTRAL
today you make history bc today you conquer the unknown fear appleevent,NEGATIVE,NEGATIVE,NEGATIVE
new battery icon in ios that features a visual indication of the charge level ios iosbeta iphonepro iphonepromax iosbeta,POSITIVE,POSITIVE,POSITIVE
unboxing the rs iphone pro in india iphonepro unboxing,NEUTRAL,NEUTRAL,NEUTRAL
bess colour iphonepro,NEUTRAL,NEUTRAL,NEUTRAL
comparison between iphonepromax and iphonepromax x camera the latter is also a few seconds faster,NEUTRAL,NEUTRAL,NEUTRAL
hello test iphonepro,NEUTRAL,NEUTRAL,NEUTRAL
sunrise this morning on dartmoor iphonepromax,NEUTRAL,NEUTRAL,NEUTRAL
you wanted it here it is win an iphone promax heres how follow like and retweet once the strikexwallet is live leave a review the winner will be picked once the app gets reviews in each store strikex iphone giveaway iphone,POSITIVE,POSITIVE,POSITIVE
waiting for the iphone pro max to be delivered iphonepromax iphone,NEUTRAL,NEUTRAL,NEUTRAL
iphone features release date and rumours related to it iphonepro iphonexdtac iphonepromax,NEUTRAL,NEUTRAL,NEUTRAL
red ant collecting pollen photography photographers photographer macro iphone iphonepromax apple ios nft animals shotoniphone,NEUTRAL,NEUTRAL,NEUTRAL
hey when will it be iphonepro,NEGATIVE,NEUTRAL,NEUTRAL
iphone pro max is a beast apple iphonepromax,POSITIVE,POSITIVE,POSITIVE
your shipment is on its way airpodspro,NEUTRAL,NEUTRAL,NEUTRAL
i dont even know why i preordered this damn iphone since they talking about i wont get it until late octoberearly novemberlike what come on now iphonepromax apple,NEGATIVE,NEGATIVE,NEGATIVE
got some apple gadgets or game consoles you needed to sell for cash just dm apple ios iphone salisu kalyjay president queenelizabeth,NEUTRAL,NEUTRAL,NEUTRAL
did you know steve jobs never wanted a sim card slot on the first iphone since there are fuzz about apple going full es,NEUTRAL,NEUTRAL,NEUTRAL
wizkid fc after seeing everything asake is doing to them asuu davido innoson nans fireboy endasuustrikenow calabar iphone rema windsor benin ikeja blacks putin efcc,NEUTRAL,NEUTRAL,NEUTRAL
i fixed the iphone pro always on display iphonepro alwaysondisplay ios,NEUTRAL,NEUTRAL,NEUTRAL
this box looks and feels really really good new applewatchultra,POSITIVE,POSITIVE,POSITIVE
applewatch ima mecha hima pc locker ni wasureta,NEUTRAL,NEUTRAL,NEUTRAL
how to rename your airpods change the name of your airpods,NEUTRAL,NEUTRAL,NEUTRAL
iphone progb spaceblack gb spaceblacksilvergolddeeppurple gb deeppurplespaceblackgold tb deeppurplespaceblacksilvergold,NEUTRAL,NEUTRAL,NEUTRAL
they need to get all the bugs out while my phone is on back order iphonepro,NEUTRAL,NEUTRAL,NEUTRAL
iphone and ios copy and paste feature,NEUTRAL,NEUTRAL,NEUTRAL
how many trends do you have unlocked on your applewatch,NEUTRAL,NEUTRAL,NEUTRAL
iphone series now up for preorder flat instant discount on hdfc bank cards iphone amp iphoneplus,NEUTRAL,NEUTRAL,NEUTRAL
applewatch tip switch off apple watch tip switch off it sounds basic but it might not be obvious how to turn the watch off to do so press and hold the side button the one under the digital crown you will see sliders on the,NEUTRAL,NEUTRAL,NEUTRAL
iphonepromax at heres how to grab the offer,NEUTRAL,NEUTRAL,NEUTRAL
apple iphone pro and iphone pro ma check with seller iphone iphonpromax apple,NEUTRAL,NEUTRAL,NEUTRAL
shot on iphone pro civic typer fk,NEUTRAL,NEUTRAL,NEUTRAL
iphone plus gb purple,NEUTRAL,NEUTRAL,NEUTRAL
a few tips about some of iphones new features,NEUTRAL,NEUTRAL,NEUTRAL
unboxing the iphonepro i bought this for software development purposes only,NEUTRAL,NEUTRAL,NEUTRAL
its official rattlesnake,NEUTRAL,NEUTRAL,NEUTRAL
