tweet,label_1,label_2,final_label
iphone pro users complain about the camera,NEGATIVE,NEGATIVE,NEGATIVE
photography is life photooftheday iphone,NEUTRAL,NEUTRAL,NEUTRAL
new battery icon in ios beta ios iphonepro,NEUTRAL,NEUTRAL,NEUTRAL
iphonexs iphonepro,NEUTRAL,NEUTRAL,NEUTRAL
working black people to greatness from the museum of black civilization senegal al,NEUTRAL,NEUTRAL,NEUTRAL
iphone x giveaway iphone iphonepro giveaway,NEUTRAL,NEUTRAL,NEUTRAL
the owner of youtube channel techrax simulated a realcar crash to confirm whether this feature actually works or not,NEUTRAL,NEUTRAL,NEUTRAL
dynamicisland on iphone pro models takes indians by storm apple,NEUTRAL,NEUTRAL,NEUTRAL
who else got the iphone pro max apple iphone iphonepromax iphone iphonepro,NEUTRAL,NEUTRAL,NEUTRAL
new styles iphone series and samsung both are available shop,NEUTRAL,NEUTRAL,NEUTRAL
brand new iphoneusa spec with esim iphone gbn iphone promax gbn brand new iphone series international version with sim seat iphone gb iphone promax gbblackn iphone promax goldn,NEUTRAL,NEUTRAL,NEUTRAL
hours dude i am on hours now applewatchultra is the goat,POSITIVE,POSITIVE,POSITIVE
fall crocuses are in bloom time to harvest some saffron shot with iphonepro macro developed in hipstamatic with th,NEUTRAL,NEUTRAL,NEUTRAL
lets get on with this early what do you think is going to be on the iphone this next year iphone appleevent apple,POSITIVE,NEUTRAL,POSITIVE
recording day picture taken on the iphonepro,NEUTRAL,NEUTRAL,NEUTRAL
and remember applewatch applewatchultra,NEUTRAL,NEUTRAL,NEUTRAL
watch iphone camera hype apple iphone and the megapixel camera on youtube,NEUTRAL,NEUTRAL,NEUTRAL
did you know that in the new iphone you cannot have a physical sim iphone iphonepro ripsim,NEUTRAL,NEUTRAL,NEUTRAL
iphone craze kerala man flies to dubai to buy the device ahead of india release,POSITIVE,POSITIVE,POSITIVE
i feel offended by this discrimination sugardaddyneededasap appleevent,NEGATIVE,POSITIVE,NEGATIVE
iphone isnt the only expensive consumer tech product launching this month rtx,NEUTRAL,NEUTRAL,NEUTRAL
a new iphone,NEUTRAL,NEUTRAL,NEUTRAL
record score hit the island hittheisland dynamicisland iphonepromax iphone ios apple,NEUTRAL,NEUTRAL,NEUTRAL
omg theres an iphone already didnt the just come out and people will continue to upgrade these phones every year when they dont need it,NEUTRAL,NEUTRAL,NEUTRAL
for sunday on ios with showapp showlive icons palette_stock ioshomescreen iosicons shortcuts wallpaper me ios iphonepromax iphonepromax showlive preset,NEUTRAL,NEUTRAL,NEUTRAL
something telling me to go get the iphonepromax but i have always been a android user i think i just might wait until february and get the galaxys,NEUTRAL,NEUTRAL,NEUTRAL
battery after more than hours of use applewatchultra,NEUTRAL,NEUTRAL,NEUTRAL
easy,POSITIVE,NEUTRAL,POSITIVE
why is my iphonepromax getting so hot mind you i only had it for hours,NEUTRAL,NEUTRAL,NEUTRAL
so thats where all the iphone stock went,NEUTRAL,NEUTRAL,NEUTRAL
am i the only one who has found out this new apple copying of photos ios appleevent iphonepro,POSITIVE,POSITIVE,POSITIVE
apple releases ios with iphone bug fixes ios iosbeta ios apple iphonepro iphone iphonebug,NEUTRAL,NEUTRAL,NEUTRAL
thanks and good luck check out,POSITIVE,NEUTRAL,POSITIVE
considering a new iphonepromax then watch this first how big is the new phone amp do accessories work,NEUTRAL,NEUTRAL,NEUTRAL
imagine buying a brand new iphone pro max but no one to text to,NEGATIVE,NEGATIVE,NEGATIVE
keep your self hydrated for such courage with appleevent iphone newlaunch,POSITIVE,NEGATIVE,NEUTRAL
not nearly as ostentatious as i had initially imagined and this band isdare i say comfortable applewatchultra,POSITIVE,POSITIVE,POSITIVE
i cant think of any use cases for a cellular apple watch having my iphone with me of the time applewatchultra,NEGATIVE,NEGATIVE,NEGATIVE
apple iphone pro max deep purple hands on unboxing first look,NEUTRAL,NEUTRAL,NEUTRAL
iphone iphonepromax,NEUTRAL,NEUTRAL,NEUTRAL
breaking apple releases fixes for iphone pro camera shaking and constant copy,POSITIVE,POSITIVE,POSITIVE
seriously theres a great deal to love on these gorgeous devices applewatchse,POSITIVE,POSITIVE,POSITIVE
apple airpods pro nd generation wireless earbuds with magsafe charging case airpodspro apple order soon,NEUTRAL,NEUTRAL,NEUTRAL
applewatch tip cover your watch to turn on silent mode have you ever been in a work meeting and suddenly your watch makes that notification chime obviously you can quickly cover the watch to mute the notification but you cant really,NEUTRAL,NEUTRAL,NEUTRAL
them things got bass airpodspro,NEUTRAL,NEUTRAL,NEUTRAL
my phone been acting up lately so i went and got an upgrade iphonepro,POSITIVE,POSITIVE,POSITIVE
what does the iphone pro make you a pro of or is it the phone itself thats the pro iphonepro apple technology,NEUTRAL,NEUTRAL,NEUTRAL
if you dont try you will never know your full potential giveaway iphonepro appleevent iphone,POSITIVE,POSITIVE,POSITIVE
so much there are a number of reasons why people continue to use their phones even with a broken screens in some cases people may not be able to afford to replace their screen or may not have the time to get it iphone obidients iranprotests andriod,NEGATIVE,NEGATIVE,NEGATIVE
ipados beta lock screen customization,NEUTRAL,NEUTRAL,NEUTRAL
double wallpapers one for the lock screen and one for the home screen apple iphone iphone iphonepro iphonepromax wallpaper wallpapers,NEUTRAL,NEUTRAL,NEUTRAL
pictures of a london sunrise shot on pro maxlondon iphonepromax shotoniphone,NEUTRAL,NEUTRAL,NEUTRAL
buying and iphone is bigger than any achievement for these genz people iphone,POSITIVE,POSITIVE,POSITIVE
when everyone is waiting for new iphone im waiting for ios appleevent ios apple,NEUTRAL,NEUTRAL,NEUTRAL
no humans or iphones were harmed during the test myc mycnews mycfreshfaces techandapp apple crashdetection emergency experiment iwatch iphone youtube crash,NEUTRAL,NEUTRAL,NEUTRAL
alwaysondisplay eats up less than of the battery per hour in high ambient light on iphonepro,NEUTRAL,NEUTRAL,NEUTRAL
still waiting for my new apple watch series in midnight from over a week after release anyone else having issues applewatch apple series vodafone,NEUTRAL,NEUTRAL,NEUTRAL
i still cant believe to get that battery life on a applewatch you have to spend,NEUTRAL,NEUTRAL,NEUTRAL
am in love with the dynamic island on the iphone pro max appleevent iphone iphonepromax iphoneseries,POSITIVE,POSITIVE,POSITIVE
the iphonese is as little as and the iphonepromax is as much as but budget is only one thing to con,NEUTRAL,NEUTRAL,NEUTRAL
relatable lets affirm every single of our investments turn out to be multibaggers apple appleevent iph,POSITIVE,POSITIVE,POSITIVE
walking around a bit iphonepromax,NEUTRAL,NEUTRAL,NEUTRAL
tropicana gardens mall iphone iphonepro iphonepromax midnight launch,NEUTRAL,NEUTRAL,NEUTRAL
its early thu morning and says my airpodspro shipped,NEUTRAL,NEUTRAL,NEUTRAL
huh is that a samsung or an iphone pro max,NEUTRAL,NEUTRAL,NEUTRAL
rt gizbot what was the result iphonepro youtuber test,NEUTRAL,NEUTRAL,NEUTRAL
i phone iphone,NEUTRAL,NEUTRAL,NEUTRAL
but here was saturdays sot iphonepro,NEUTRAL,NEUTRAL,NEUTRAL
been wondering if my jaan has got his new phone iphonepromax yet you are doing outdoors in chennai maybe ja,NEUTRAL,NEUTRAL,NEUTRAL
the camera gets bigger ever year iphone iphonepromax iphonepromax iphonepromax apple,NEUTRAL,NEUTRAL,NEUTRAL
apple watch ultra unboxing,NEUTRAL,NEUTRAL,NEUTRAL
gm,NEUTRAL,NEUTRAL,NEUTRAL
k for iphone,NEUTRAL,NEUTRAL,NEUTRAL
just need to find someone out there who can gift me an apple watch ultra applewatchultra,POSITIVE,NEGATIVE,NEGATIVE
looking for a way to buy the brandnew iphonepro for cheap check out this deal from atampt,NEUTRAL,NEUTRAL,NEUTRAL
got the new iphonepro and the first model who came my way was went to my terrace amp shot this when the,NEUTRAL,NEUTRAL,NEUTRAL
iphone progb spaceblackgold gb spaceblacksilvergolddeeppurple gb deeppurplespaceblack,NEUTRAL,NEUTRAL,NEUTRAL
iphone am buying just two what about you,NEUTRAL,NEUTRAL,NEUTRAL
apple iphone gb blue,NEUTRAL,NEUTRAL,NEUTRAL
iphonepromax is da shit,NEGATIVE,NEGATIVE,NEGATIVE
hmmm did you cop iphonepromax,NEUTRAL,NEUTRAL,NEUTRAL
is there a digital time option for any of the new applewatchultra faces or are they all only analog,NEUTRAL,NEUTRAL,NEUTRAL
wat will ur man say wen he see u with an iphone another man bought for you,NEUTRAL,NEUTRAL,NEUTRAL
dont know about spotify i only know about apple music,NEUTRAL,NEUTRAL,NEUTRAL
iphone procean apple iphonepro,NEUTRAL,NEUTRAL,NEUTRAL
when im hear any things then i realised this im sad appleevent,NEGATIVE,NEGATIVE,NEGATIVE
some of the early buyers of iphonepro or iphonepromax have reported issues with the rear camera,NEUTRAL,NEUTRAL,NEUTRAL
my mama just called me to ask how do she hook her applewatch up to her iphone again and she been having that watch for years now,NEUTRAL,NEUTRAL,NEUTRAL
tiny dynamic island glitch iphonepro,NEGATIVE,NEGATIVE,NEGATIVE
night mode on iphonepro,NEUTRAL,NEUTRAL,NEUTRAL
what are you waiting for preorder the new iphone or purchase your favourite apple devices today in easytopay instalments tampcs apply omanarabbank iepp iphone,NEUTRAL,NEUTRAL,NEUTRAL
hehe just traded in my old iphone for the iphone pro and wow its so damn nice,POSITIVE,POSITIVE,POSITIVE
windows cant open iphone photos how to convert heic files to jpgpng on windows learn from this post,NEUTRAL,NEUTRAL,NEUTRAL
brandnew iphone series available physical sim callwhatsappdm to place your order nationwide delivery raytechgadgetsphones iphone trending explorepage viralvideos brandnew uniport lagos abujabusiness abujamarket ekpoma,NEUTRAL,NEUTRAL,NEUTRAL
ear tips in new airpods pro incompatible with older model apple airpodspro devices activenoisecancellation apple earti,NEUTRAL,NEUTRAL,NEUTRAL
some quick snaps with the new toy iphonepro,NEUTRAL,NEUTRAL,NEUTRAL
precision its what were known for deviceland torranceca torrancelocal torrance longbeach redondobeach losangeles torrancecommunity downtowntorrance appleproducts shopapple applewatch applemusic applewatchbands applewatchband appleiphone applestore,NEUTRAL,NEUTRAL,NEUTRAL
japanhomekit sporting goods store customized shirts shipping worldwide fifaworldcup nike adidas jersey london youtube tiktok iphone jfa daihyo samuraiblue tver onepiece auspol jleague,NEUTRAL,NEUTRAL,NEUTRAL
yes the orange alpine band glows in black light applewatchultra,POSITIVE,POSITIVE,POSITIVE
unboxing del iphone pro max unboxing iphonepromax iphonepromaxunboxing,NEUTRAL,NEUTRAL,NEUTRAL
iphone a tazz in your pocket you can literally buy a tazz vehicle with this money rushhour iphonepro,NEUTRAL,NEUTRAL,NEUTRAL
its big but i dont mind applewatchultra,NEUTRAL,NEGATIVE,NEUTRAL
some of you go still carry bike go buy iphone mad generation lol,NEGATIVE,NEGATIVE,NEGATIVE
time for an iphone,NEUTRAL,NEUTRAL,NEUTRAL
being an apple watch user and forgetting your watch at home is on the same level as leaving your phone at home just feel,NEUTRAL,NEUTRAL,NEUTRAL
apple reportedly scaling back iphone production as customers opt for pro models,NEUTRAL,NEUTRAL,NEUTRAL
nap time for cats group cats napping in the street,NEUTRAL,NEUTRAL,NEUTRAL
theres apparently a fix on the way for the iphonepro camerashakebug but it seems thats not the only issue with the new iphone camera that users are encountering,NEUTRAL,NEUTRAL,NEUTRAL
the iphone is almost here and why not get your hands on one visit our website where you can get yours on preorder now until stock lasts eampoe ts amp cs apply contact info,NEUTRAL,NEUTRAL,NEUTRAL
stone m deep bass magic tone filter the noisehear the sound with enc technology check our bio to order now airpodspro,NEUTRAL,NEUTRAL,NEUTRAL
applewatchseries has arrived today apple applewatch,NEUTRAL,NEUTRAL,NEUTRAL
who is trying to get some messages unsent update your iphone to the new ios ios iphone,NEUTRAL,NEUTRAL,NEUTRAL
finding some camera issues iphonepromax day samsung,NEUTRAL,NEUTRAL,NEUTRAL
and i speak for all of humanity we want to chose what contacts are added to our contacts book from facebook thanks,NEGATIVE,NEGATIVE,NEGATIVE
lets gooo twitter for ipad,NEUTRAL,NEUTRAL,NEUTRAL
apple airpodspro apple airpods pro nd generation,NEUTRAL,NEUTRAL,NEUTRAL
apple watch series quick tour unboxing,NEUTRAL,NEUTRAL,NEUTRAL
the dynamic island feature on iphonepro models has taken the indian fans by storm and industry experts said on wednesday that the feature is turning out to be a key differentiator in their choice of owning new iphones iphonepromax,POSITIVE,POSITIVE,POSITIVE
did you take it with the new iphone pro,NEUTRAL,NEUTRAL,NEUTRAL
techinsights teardown team believes they found the satellite chip in the apple iphone and their teardown subscribers ca,NEUTRAL,NEUTRAL,NEUTRAL
i just published which mobile phone is better iphone pro max or the iphone pro max iphonepro iphone iphone,NEUTRAL,NEUTRAL,NEUTRAL
techinsights dismantled the iphone and found that although the iphone this year still uses the previousgeneration a chip the pcb layout of the entire motherboard is newly designed apple iphoneseries iphone iphoneplus iphonepro iphonepromax,NEUTRAL,NEUTRAL,NEUTRAL
for sunday on ios with showapp showlive icons palette_stock ioshomescreen iosico,NEUTRAL,NEUTRAL,NEUTRAL
apple speaks a lot on saving lives with applewatch and yet still wont accomodate for rest days or injuries and recovery time,NEUTRAL,NEGATIVE,NEGATIVE
the life of my iphone was only hours because someone out there thought its easier to rob then actually buy,NEGATIVE,NEGATIVE,NEGATIVE
ios app switcher showing white lines over some apps iphonepro,NEUTRAL,NEUTRAL,NEUTRAL
apple watch series colour options appleevent,NEUTRAL,NEUTRAL,NEUTRAL
unboxing my new deep purple iphonepro,NEUTRAL,NEUTRAL,NEUTRAL
some apple iphone pro series users experience slow camera opening,NEUTRAL,NEUTRAL,NEUTRAL
street art iphonepromax sky multicolored painting mural art lansing lansingmichigan puremichigan,NEUTRAL,NEUTRAL,NEUTRAL
apple why no usbc appleevent,NEGATIVE,NEGATIVE,NEGATIVE
got my first ever apple watch series amp had to pick up the new iphone pro max in deep purple all my content shot on iph,NEUTRAL,NEUTRAL,NEUTRAL
iphone pro and pro max available at affordable price contact us on,NEUTRAL,NEUTRAL,NEUTRAL
an amazing opportunity,POSITIVE,POSITIVE,POSITIVE
calling mr prk seham your boyfie is asking for a case for his iphone pro max i repeat your boyfie is asking for a case for his iphone pro max,NEUTRAL,NEUTRAL,NEUTRAL
iphone pro customers plagued with issues just days after release macrumors,NEUTRAL,NEUTRAL,NEUTRAL
iphonepromax waiting on the ??? so i can get back to my photography,NEUTRAL,NEUTRAL,NEUTRAL
that iphone deep purple is just there,NEUTRAL,NEUTRAL,NEUTRAL
uae long queues at dubai mall to buy iphone,NEUTRAL,NEUTRAL,NEUTRAL
photonic engine on iphone what is it and how does it work check it out by,NEUTRAL,NEUTRAL,NEUTRAL
everyone is trolling apple for doing little efforts on camera cutouts saying they just moved the notch little down with rounded corners meanwhile android companies having same punch hole on all their phones apple iphones android iphone iphone iphonepromax,NEGATIVE,NEGATIVE,NEGATIVE
welp now i got to buy the iphonepro,NEUTRAL,NEUTRAL,NEUTRAL
iphone vs iphone reparieren lohnt sich iphone vs iphone repairing pays off iphone iphonerepair ifixiteurope,NEUTRAL,NEUTRAL,NEUTRAL
sneak peak iphone iphone abujatwittercommunity,NEUTRAL,NEUTRAL,NEUTRAL
apple applewatch ultra come on england uk,NEUTRAL,NEUTRAL,NEUTRAL
for sale direct brief a mix use full plot of land with a foundation on it for sale directly ekoro road abule egba,NEUTRAL,NEUTRAL,NEUTRAL
especially dis iphone,NEUTRAL,NEUTRAL,NEUTRAL
argentina away soccer jersey sporting goods store customized shirts shipping worldwide whatsapp fifaworldcup nike adidas jersey london youtube tiktok iphone thfc dorevenge premierleague troph??esunfp nationsleague,NEUTRAL,NEUTRAL,NEUTRAL
some pictures ive taken with the iphonepromax,NEUTRAL,NEUTRAL,NEUTRAL
anyone else pick up the new apple airpods pro nd gen what do you think should i do a review on them let me know airpodspro airpods apple newness tech gadgets,NEUTRAL,NEUTRAL,NEUTRAL
i really cant get over the iphonepro camera,POSITIVE,POSITIVE,POSITIVE
becoci design for iphone pro max case compatible with magsafe iphonepromax iphone,NEUTRAL,NEUTRAL,NEUTRAL
iphone pro maxgb deeppurplespaceblacksilver gb deeppurplespaceblacksilvergold gb deeppurple,NEUTRAL,NEUTRAL,NEUTRAL
say hello to my new runskiclimb partner applewatchultra,NEUTRAL,NEUTRAL,NEUTRAL
this iphone pro feature is w ios iphonepromax apple,NEUTRAL,NEUTRAL,NEUTRAL
are you excited to see the new iphone during todays appleevent,POSITIVE,POSITIVE,POSITIVE
beginning in october apple raised the prices of app store apps inapp purchases in all territories that use the euro,NEUTRAL,NEUTRAL,NEUTRAL
of brain usage memes python pythonprogramming pythonmemes hacking hackingmemes programmingmemes programmin,NEUTRAL,NEUTRAL,NEUTRAL
apple stellt apple watch se und ultra vor apple applewatch applewatchultra applewatchseries keynote h,NEUTRAL,NEUTRAL,NEUTRAL
what made you go fitbit over an applewatch,NEUTRAL,NEUTRAL,NEUTRAL
latest deals hot deals brand new iphone promax gb purple available million naira only iphone,NEUTRAL,NEUTRAL,NEUTRAL
omg what happened on new launch iphone iphone trending twitter caneloggg,NEUTRAL,NEUTRAL,NEUTRAL
tips if you just bought a new apple watch you dont have to ditch your old one because apple makes it easy to use two,POSITIVE,NEUTRAL,POSITIVE
launch event of iphone apple iphone,NEUTRAL,NEUTRAL,NEUTRAL
now is the time to come to and experience the leadering the new iphonepro is here and is on us come see us for more details,NEUTRAL,NEUTRAL,NEUTRAL
apple iphone series vs iphone series battery comparison iphone iphonepro iphonepromax iphoneplus iphone iphonepro iphonemini,NEUTRAL,NEUTRAL,NEUTRAL
how to enable crash detection on iphone apple watch,NEUTRAL,NEUTRAL,NEUTRAL
oem apple everything iphonepromax,NEUTRAL,NEUTRAL,NEUTRAL
apple may move a quarter of iphone production to india by jpmorgan apple iphone india china airpods applewatch foxconn,NEUTRAL,NEUTRAL,NEUTRAL
going to turn my iphone into a always on display iphone iphone apple iphonepro,NEUTRAL,NEUTRAL,NEUTRAL
the first fall storm of the year is upon us pineaz arizona chaletforet iphonepro,NEUTRAL,NEUTRAL,NEUTRAL
why r these random peeps in my dms someone even asked for my apple id t__t,NEUTRAL,NEUTRAL,NEUTRAL
should change deeppurple to tactical amethyst iphonepromax,NEUTRAL,NEUTRAL,NEUTRAL
if i could buy just stock right now apple would be it heres why investing stocks iphone,NEUTRAL,NEUTRAL,NEUTRAL
will fix the iphone pros camera shake,POSITIVE,POSITIVE,POSITIVE
we know a thing or two about crowns around here on the goat squad kingjames iphone itsamazing,NEUTRAL,NEUTRAL,NEUTRAL
what phone did you keep purple or white its so expensive here iphonepromax,NEUTRAL,NEUTRAL,NEUTRAL
qampa could an applewatch change the onesizefitsall approach to afib,NEUTRAL,NEUTRAL,NEUTRAL
x zoom which is better iphonepromax vs galaxyzfold,NEUTRAL,NEUTRAL,NEUTRAL
cant wait to give my full review of the iphonepro,NEUTRAL,NEUTRAL,NEUTRAL
my new apple iphone was born in zhengzhou china on then traveled to republic of korea anchorage alaska lou,NEUTRAL,NEUTRAL,NEUTRAL
from bus windows on the way home from work iphonepromax,NEUTRAL,NEUTRAL,NEUTRAL
new iphone pro colors appleevent,NEUTRAL,NEUTRAL,NEUTRAL
using a stainless steel link bracelet with applewatchultra is like cooking chicken in nyquil,POSITIVE,POSITIVE,POSITIVE
green icey whitesox by shot on iphonepromax,NEUTRAL,NEUTRAL,NEUTRAL
apple ipad air inch gb tablet gold renewed appleipad apple appleipadpro ipadair appleipadmini ipad appleiphone ipadpro applewatch appleairpods appleproducts macbook applepencilart applemusic applelover technology ipados applestore ios,NEUTRAL,NEUTRAL,NEUTRAL
its dynamicisland day yall geeksruletheworld earlyadoptersgotoheaven iphonepromax iphone,NEUTRAL,NEUTRAL,NEUTRAL
apple iphone pro max transparent mechanical gear design case iphone,NEUTRAL,NEUTRAL,NEUTRAL
iphone pro and pro max were seen producing unclear or noisy images while using snapchat tik tok and more are you facing the same issue iphone iphone iphonepro iphonepromax promax iphoneissue iphoneproblem softwereissue angular javascript html twitme,NEGATIVE,NEGATIVE,NEGATIVE
hi tea and biscuits,NEUTRAL,NEUTRAL,NEUTRAL
iphone did all the hardwork n research for dynamic island and android just made an app call dynamic spot dear apple u r wasting time not android iphonepro dynamicisland dont laugh pls,NEGATIVE,NEGATIVE,NEGATIVE
your phone cant do this,NEUTRAL,NEUTRAL,NEUTRAL
apple airpods pro wireless headphone review roundup,NEUTRAL,NEUTRAL,NEUTRAL
here are five iphone pro features that are already available on android smartphones iphonepro apple iphone sa,NEUTRAL,NEUTRAL,NEUTRAL
y un applewatch,NEUTRAL,NEUTRAL,NEUTRAL
hot iphone renders by iphone iphonepro iphonepromax rt,NEUTRAL,NEUTRAL,NEUTRAL
meow iphone,NEUTRAL,NEUTRAL,NEUTRAL
iphone yuletide edochiestil tied to dads apronstring though already made dadebubedike ezechimeh highest cockerel in africas movie industrya grandpa ie promotion his dadhe insists teary eyes movin in with olu jacobsamppete edochiefags gay couplesto wisteria lane,NEUTRAL,NEUTRAL,NEUTRAL
in every review they are talking about putting timer in the dynamicisland whos gona use timer all the time apple iphonepromax,NEUTRAL,NEUTRAL,NEUTRAL
theyre here apple iphonepromax,NEUTRAL,NEUTRAL,NEUTRAL
yup space black was the right choice was right iphonepro,NEUTRAL,NEUTRAL,NEUTRAL
video tip there is an incredibly capable camera and app on the allnew iphone pro amp iphone pro max heres how to get the best shots possible iphonepro,POSITIVE,POSITIVE,POSITIVE
apple watch se nd gen positive summary appleevent applewatchse,POSITIVE,POSITIVE,POSITIVE
insane apple iphone pro max specifications overview iphonepromax appleevent,POSITIVE,POSITIVE,POSITIVE
man this iphonepro is a battery hog terrible,NEGATIVE,NEGATIVE,NEGATIVE
band for you applewatch applewatchultra,NEUTRAL,NEUTRAL,NEUTRAL
looking to replace your firstgen airpods and dont need anc get these instead of airpodspro deals gadgets,NEUTRAL,NEUTRAL,NEUTRAL
if there are ducks we go shot on iphonepromax,NEUTRAL,NEUTRAL,NEUTRAL
fikkar not bro now you too can afford iphone pro be a banksathi advisor and earn up to digits salary in a mon,NEUTRAL,NEUTRAL,NEUTRAL
not loud enough if you ask me music therapy ios airpodspro,NEUTRAL,NEUTRAL,NEUTRAL
the new iphone pro taking a night snap of the my just look at those stars teslamy iphonepro elonmusk tesla blacktesla,NEUTRAL,NEUTRAL,NEUTRAL
i finally got my iphonepromax,NEUTRAL,NEUTRAL,NEUTRAL
the majesty of the iphone available for sale now at affordable price without exaggeration iphonepromax,POSITIVE,POSITIVE,POSITIVE
how do you feel about the dynamic island iphone applenews apple appleiphone applewatch ios pro applefan ap,POSITIVE,NEGATIVE,NEUTRAL
no appleevent in october instead new ipad and mac products will drop through press releases,NEUTRAL,NEGATIVE,NEUTRAL
does anyone else have this issue with the iphone pro where you cant swipe between the home screen pages ive factory reset my phone and everything iphonepro apple,NEUTRAL,NEUTRAL,NEUTRAL
has anyone had an issue w their phone literally shutting off during the night while being charged my friends did it once since ios and my pro max did last night lock button would not wake phone had to do hard restart almost overslept ios iphonepromax,NEGATIVE,NEGATIVE,NEGATIVE
a new report suggests all models of the iphone lineup will feature the dynamic island notch iphone appleevent leakvideos,NEUTRAL,NEUTRAL,NEUTRAL
find the notch then,NEUTRAL,NEUTRAL,NEUTRAL
just do it with iphone you dont need any dslr,NEUTRAL,POSITIVE,POSITIVE
new model iphone cases iphone iphone iphonepromax iphoneplus,NEUTRAL,NEUTRAL,NEUTRAL
a clients order everything from aboki gadgets abokigadgets buyoncebuyright ps iphonepro,NEUTRAL,NEUTRAL,NEUTRAL
new video on tiktok unboxing my iphonepro space black and the storm blue silicone case and trying out the dynamicisland,NEUTRAL,NEUTRAL,NEUTRAL
htmlsandbox v hs modified icons mockup iphonepro nojailbreak,NEUTRAL,NEUTRAL,NEUTRAL
iphone wallet cases,NEUTRAL,NEUTRAL,NEUTRAL
front look comparison between iphone pro series and xiaomi civi xiaomicivi iphonepro iphonepromax,NEUTRAL,NEUTRAL,NEUTRAL
its finally here iphone pro max now available only phonehubkla along william str kisa kyamaria buildingdm here or contactwatsup for more details noteswaps are allowed,NEUTRAL,NEUTRAL,NEUTRAL
some sample photos of iphonepro,NEUTRAL,NEUTRAL,NEUTRAL
i switched to apples iphone from iphone mini heres how my experience changed apple iphone iphonemini,NEUTRAL,NEUTRAL,NEUTRAL
nike travis scott air trainer sp mens send us a dm,NEUTRAL,NEUTRAL,NEUTRAL
iphone oo this kind buddy plenty for my area,POSITIVE,POSITIVE,POSITIVE
capture on the iphone pro max with stage light portrait mode iphonepro,NEUTRAL,NEUTRAL,NEUTRAL
got a little too curious and tried the dynamic island stuff on a notch not that elegant in looks but would definit,POSITIVE,NEUTRAL,POSITIVE
so to finish this thread i think you should switch to the latest iphone if you can afford it or you come from a very old previous iphone apple iphonepro,NEUTRAL,NEUTRAL,NEUTRAL
heres the new iphone pro max in deep purple,NEUTRAL,NEUTRAL,NEUTRAL
twitter is my morning newspaper,NEUTRAL,NEUTRAL,NEUTRAL
wallpaper lookscreen hp aesthetic a thread iphone kimtaehyung bornpink nct_,NEUTRAL,NEUTRAL,NEUTRAL
